author1_last_name,author1_first_name,author2_last_name,author2_first_name,editor1_last_name,editor1_first_name,title,original_date_of_publication,second_or_later_date_of_publication,volume,publisher,publisher_location,number_of_pages,dictation,name_of_transcriber,translation,name_of_translator,summary,occupations,date_of_birth,date_of_death,place_of_birth,other_places_lived
BLAKEY,Robert,N/A,N/A,N/A,N/A,Memolrs,1879,N/A,N/A,N/A,N/A,N/A,N/A,N/A,N/A,N/A,"His boyhood in N, England; studies; philosophy; scholar friends; professorship in Belfast; teaching and writing.",Scholar; Professor,N/A,N/A,N/A,N/A
BLAKHALL,Gilbert,N/A,N/A,N/A,N/A,Brieffe Naration,1844,N/A,N/A,N/A,N/A,N/A,N/A,N/A,N/A,N/A,"Work of priest with Scots mission in France and in Netherlands and Scotland, 1631-1649; travel and adventures; lively.",Priest,N/A,N/A,N/A,N/A
BLAKISTON,John (Maj.),N/A,N/A,N/A,N/A,Military Adventures; Twelve 'aenty Years of Retirement,1829; 1836,N/A,N/A,N/A,N/A,N/A,N/A,N/A,N/A,N/A,"Military service in India; and with Wellington in Peninsular War; farming and art in Midlands; country life, social and.",Major; Military personnel,N/A,N/A,N/A,N/A
BLAMPIED,H.J.,N/A,N/A,N/A,N/A,7. land Regiment,1918,N/A,N/A,N/A,N/A,N/A,N/A,N/A,N/A,N/A,Serving in France and Iraq during WWI; details of daily life.,Captain; Military,N/A,N/A,N/A,N/A
BLAND,Robert Henderson,N/A,N/A,N/A,N/A,Actor-Soldier-Poet,1939,N/A,N/A,N/A,N/A,N/A,N/A,N/A,N/A,N/A,Reminiscences of his theatrical work and tours; theatrical celebrities; his poems; army service in France during WWI.,Actor; Soldier; Poet,N/A,N/A,N/A,N/A
BLAND,Sarah Nash,N/A,N/A,N/A,N/A,The Field and the Garner,1854,N/A,N/A,N/A,N/A,N/A,N/A,N/A,N/A,N/A,Religious life; Sunday School and mission work in Reading in 1840s.,Missionary; Religious worker,N/A,N/A,N/A,N/A
BLAND-SUTTON,John (Sir),N/A,N/A,N/A,N/A,Story of a Surgeon,1930,N/A,N/A,N/A,N/A,N/A,N/A,N/A,N/A,N/A,"Medical education and career, 1855 to 1910; Royal College of Surgeons; travels.",Surgeon,N/A,N/A,N/A,N/A
BLASER,Bernard,N/A,N/A,N/A,N/A,Kilts,1926,N/A,N/A,N/A,N/A,N/A,N/A,N/A,N/A,N/A,"Battalion scout and mapper in Palestine, WWI; life and interests of non-comms; fighting against Turks.",Scout; Mapper; Military,N/A,N/A,N/A,N/A
BLATCHFORD,Robert,N/A,N/A,N/A,N/A,Amy; My Eighty Years,1910; 1931,N/A,N/A,N/A,N/A,N/A,N/A,N/A,N/A,N/A,My Life in the Early experiences in ranks; political work and journalism; labour and socialist movements; The Clarion & Sunday Chronicle; labour leaders.,Journalist; Political worker,N/A,N/A,N/A,N/A
BLATHAYT,Raymond,N/A,N/A,N/A,N/A,Throy Life; Tapest; of Life; % ing Down the Years,1917; 1923; 1935,N/A,N/A,N/A,N/A,N/A,N/A,N/A,N/A,N/A,"Education for church; curate in East London; his career and travels as journalist, England, the East, Hollywood; invalidism and forces which moulded him; celebrities in the arts.",Curate; Journalist,N/A,N/A,N/A,N/A
BLAUGDONE,Barbara,N/A,N/A,N/A,N/A,An_Account of,1691,N/A,N/A,N/A,N/A,N/A,N/A,N/A,N/A,N/A,"Quaker's testimony; ministry, persecutions, travels in South-West of England and Ireland.",Quaker; Minister,N/A,N/A,N/A,N/A
BLENKINSOP,Adam,N/A,N/A,N/A,N/A,Memoirs of,1852,N/A,N/A,N/A,N/A,N/A,N/A,N/A,N/A,N/A,Gloucestershire; London society; medical practice; with Wellington's army; inheritance in Spain and in America; and financial ventures; return to medicine; graphology.,Medical professional; Soldier,N/A,N/A,N/A,N/A
BLIGH,Eric Walter,N/A,N/A,N/A,N/A,Tooting Corner,1946,N/A,N/A,N/A,N/A,N/A,N/A,N/A,N/A,N/A,"Affectionate, humorous account of boyhood in London suburb; rich detail of bygone family life.",N/A,N/A,N/A,N/A,N/A
BLISS,William,N/A,N/A,N/A,N/A,Pilgrimage of Grace,1937,N/A,N/A,N/A,N/A,N/A,N/A,N/A,N/A,N/A,"Solicitor and Roman Catholic; work in Lincoln's Inn Fields; travels; meetings with Wilde, Shaw, Morris, etc.",Solicitor,N/A,N/A,N/A,N/A
BLOMEFIELD,Leonard,N/A,N/A,N/A,N/A,Chapters in My Life,1889,N/A,N/A,N/A,N/A,N/A,N/A,N/A,N/A,N/A,London; Cambridge; ordination; ministry; work in natural history; publications; scientific societies in Bath.,Minister; Natural historian,N/A,N/A,N/A,N/A
BLOMEFIELD,Mathena (Mrs.),N/A,N/A,N/A,N/A,Life in the Bow-Net and Water-Lilies,1946; 1948,N/A,N/A,N/A,N/A,N/A,N/A,N/A,N/A,N/A,"Childhood on West Norfolk farm in 80's; education, games, animals, old customs; family; deliberately charming.",N/A,N/A,N/A,N/A,N/A
BLOMFIELD,Charles James (Capt.),N/A,N/A,N/A,N/A,Once an Artist,1921,N/A,N/A,N/A,N/A,N/A,N/A,N/A,N/A,N/A,"Experiences in the Artists' Rifles from 1882; service in WWI, France; anecdotes; people.",Captain; Military,N/A,N/A,N/A,N/A
BLOMFIELD,Reginald (Sir),N/A,N/A,N/A,N/A,Memoirs,1932,N/A,N/A,N/A,N/A,N/A,N/A,N/A,N/A,N/A,Haileybury & Oxford; career as an architect; art movements and personalities; social life.,Architect,N/A,N/A,N/A,N/A
BLOOD,Bindon (Sir),N/A,N/A,N/A,N/A,Four Score Years and Ten,1933,N/A,N/A,N/A,N/A,N/A,N/A,N/A,N/A,N/A,Military career; Aldershot; India from 1871; Boer War; social and sport.,Sir; Military,N/A,N/A,N/A,N/A
BLOOM,Ursula,N/A,N/A,N/A,N/A,"Without Make-Up; Log of Yene; Time, Tide & I; Me, After the W; No Lady with Pen; No Lady in the Cart",1933; 1940; 1943; 1947; 1947; 1949,N/A,N/A,N/A,N/A,N/A,N/A,N/A,N/A,N/A,"Noisy, flippant, chattering reminiscences of childhood, many Jobs, journalism, popular writing, experiences during war; marriages, motoring; anything to make a new book; a notable representative of the fashion for perpetual gossip-column installment autobiography.",Writer; Journalist,N/A,N/A,N/A,N/A
BLOOMFIELD,Geor (Baroness),N/A,N/A,N/A,N/A,Reminiscences; Gleanings,1883; 1902,N/A,N/A,N/A,N/A,N/A,N/A,N/A,N/A,N/A,"Reminiscences of society and politics during whole of Victoria's reign; her life at court and at embassies, Berlin, Russia, Vienna; diplomats, celebrities, public affairs.",Baroness,N/A,N/A,N/A,N/A
BLOGMFIELD,Paul,N/A,N/A,N/A,N/A,Half the Battle; B.B.C.,1936; 1941,N/A,N/A,N/A,N/A,N/A,N/A,N/A,N/A,N/A,"Autobiography of his youth, including his diaries at Harrow; art, current ideas, WWI, sex and insecurity; work at the B.B.C. in Birmingham; Talks Department; critical and personal.",N/A,N/A,N/A,N/A,N/A
BLOUNT,Edward Charles (Sir),N/A,N/A,N/A,N/A,Memoirs,1902,N/A,N/A,N/A,N/A,N/A,N/A,N/A,N/A,N/A,Career as attaché in Rome and Paris; banker and railway promoter in France; Franco-Prussian War; sport and social life in Staffs.,Sir; Attaché,N/A,N/A,N/A,N/A
BLOW,Sydney,N/A,N/A,N/A,N/A,The Ghost Walks,1935,N/A,N/A,N/A,N/A,N/A,N/A,N/A,N/A,N/A,Theatrical career; playwriting; anecdotes of London theatre and music hall and of actors and plays.,Playwright; Actor,N/A,N/A,N/A,N/A
BLUECHER VON WAHLSTATT,Evelyn Mary,N/A,N/A,N/A,N/A,An English Wife in Berlin,1920,N/A,N/A,N/A,N/A,N/A,N/A,N/A,N/A,N/A,"Personal record of public events, politics, daily life in Germany during WWI and revolution.",N/A,N/A,N/A,N/A,N/A
BLUNDELL,Peter (Frank Nestle Butterworth),N/A,N/A,N/A,N/A,Confessions of a Seaman,1924,N/A,N/A,N/A,N/A,N/A,N/A,N/A,N/A,N/A,A pleasant autobiography of an engineer on tramp steamers; deck life and ports; amusing.,Engineer; Seaman,N/A,N/A,N/A,N/A
BLUNDEN,Edmund Charles,N/A,N/A,N/A,N/A,Undertones,1928,N/A,N/A,N/A,N/A,N/A,N/A,N/A,N/A,N/A,Personal experiences and reactions while serving in France in WWI; trench life; sensitive.,N/A,N/A,N/A,N/A,N/A
BLUNT,Fanny Janet Sandison (Lady),N/A,N/A,N/A,N/A,My Reminiscences,1918,N/A,N/A,N/A,N/A,N/A,N/A,N/A,N/A,N/A,"Childhood in Turkey; with consul-husband in Constantinople to 1901; social life; diplomacy, etc.",Lady; Diplomat,N/A,N/A,N/A,N/A
BLUNT,Reginald,N/A,N/A,N/A,N/A,Those Were the Days,N/A,N/A,N/A,N/A,N/A,N/A,N/A,N/A,N/A,N/A,Reminiscences of engineer; chiefly local affairs and daily life in Chelsea.,Engineer,N/A,N/A,N/A,N/A
BLUNT,Wilfred Scawen,N/A,N/A,N/A,N/A,India Under Ripon,1909,N/A,N/A,N/A,N/A,N/A,N/A,N/A,N/A,N/A,"Travel diary, 1883-84; in India during Ripon's vice-royalty; travels; political and social conditions; good.",N/A,N/A,N/A,N/A,N/A
BLYTON,William Joseph,N/A,N/A,N/A,N/A,Landfalls,1940,N/A,N/A,N/A,N/A,N/A,N/A,N/A,N/A,N/A,"Newspaper editor; farmer; and traveller; politics, literature, and country life; mental development; his meetings with famous men.",Editor; Farmer; Traveller,N/A,N/A,N/A,N/A
BOARDMAN,William H.,N/A,N/A,N/A,N/A,Vaudeville Days,1935,N/A,N/A,N/A,N/A,N/A,N/A,N/A,N/A,N/A,Orphan; Lancs; boy in circus; musician; manager of music-hall; reminiscences of the great days of variety and the great performers.,Musician; Manager,N/A,N/A,N/A,N/A
BOASE,Mabel M.,N/A,N/A,N/A,N/A,Haj Stir the Poppy Dust,1936,N/A,N/A,N/A,N/A,N/A,N/A,N/A,N/A,N/A,Childhood on east coast of Scotland in 70's and 80's; country life in Fife; pleasant and mild.,N/A,N/A,N/A,N/A,N/A
BODDY,Alexander Alfred,N/A,N/A,N/A,N/A,From the gyptian Ramleh,1900,N/A,N/A,N/A,N/A,N/A,N/A,N/A,N/A,N/A,"His travel and social life in the Delta, lower Egypt and Alexandria in the 90's.",N/A,N/A,N/A,N/A,N/A
BODKIN,Matthias M'Donnell,N/A,N/A,N/A,N/A,Regol- lections,1914,N/A,N/A,N/A,N/A,N/A,N/A,N/A,N/A,N/A,"Life and work of an Irish lawyer, judge, journalist; Parliamentary and public affairs.",Lawyer; Judge; Journalist,N/A,N/A,N/A,N/A
BODKIN,Thomas,N/A,N/A,N/A,N/A,My Uncle Frank,1941,N/A,N/A,N/A,N/A,N/A,N/A,N/A,N/A,N/A,Boyhood at uncle's farm in Ireland; a boy's life and amusements.,N/A,N/A,N/A,N/A,N/A
BODLEY,Col. Ronald Victor,N/A,N/A,N/A,N/A,Courtesy Indiscretions,1931,N/A,N/A,N/A,N/A,N/A,N/A,N/A,N/A,N/A,"Eton and Sandhurst; WW1 service; Lawrence; Paris embassy and Peace Conferences; service with Algerians; life as nomad, shepherd in Sahara; mysticism and his quest for peace of mind in Java and East.",Colonel; Eton; Sandhurst,N/A,N/A,N/A,N/A
BODLEY,Sir Thomas,N/A,N/A,N/A,N/A,The Life,1913,N/A,N/A,N/A,N/A,N/A,N/A,N/A,N/A,N/A,Family exiled by Catholic; return under Elizabeth; ambassador; rivalry of Burleigh and Essex; retirement and setting up library for Oxford students; brief and dry.,Ambassador,N/A,N/A,N/A,N/A
BOGER,Alnod John,N/A,N/A,N/A,N/A,Road I Travelled,1936,N/A,N/A,N/A,N/A,N/A,N/A,N/A,N/A,N/A,"Winchester, Oxford; legal studies; climbing and big-game hunting in India, Far East, Uganda, & Norway, etc.",Lawyer,N/A,N/A,N/A,N/A
BOGGIS,Robert James Edmund,N/A,N/A,N/A,N/A,I Remember,1947,N/A,N/A,N/A,N/A,N/A,N/A,N/A,N/A,N/A,Clerical work and social life in Exeter.,N/A,N/A,N/A,N/A,N/A
BOGLE,J. Linton,N/A,N/A,N/A,N/A,Mo; re Meandering:,1938,N/A,N/A,N/A,N/A,N/A,N/A,N/A,N/A,N/A,Doctor's trips in England and on continent.,Doctor,N/A,N/A,N/A,N/A
BOLITHO,Henry Hector,N/A,N/A,N/A,N/A,Thistledowné & Thunder,1928,N/A,N/A,N/A,N/A,N/A,N/A,N/A,N/A,N/A,"A New Zealand author's travel notes, 1915 to 1927, empire, America, Europe; youth in N.Z.; career as writer; writing, the arts; Shaw, Ellen Terry, Lawrence.",Author,N/A,N/A,N/A,N/A
BOLTON,Glorney and Sybil,N/A,N/A,N/A,N/A,Two Lives Converge,1938,N/A,N/A,N/A,N/A,N/A,N/A,N/A,N/A,N/A,Dual autobiography; his work at Bodleian; Oxford life; and Journalism in Yorkshire; her education at convent in Holland; childhood in W. Riding; anglo-catholicism; journalism; public affairs.,Journalist; Educator,N/A,N/A,N/A,N/A
BOLTON,John,N/A,N/A,N/A,N/A,Personal Narrative,1871,N/A,N/A,N/A,N/A,N/A,N/A,N/A,N/A,N/A,Residence in Barnsley 1818-42; industrial & labour troubles; Chartism; Jacquard loom.,N/A,N/A,N/A,N/A,N/A
BOLKELL,F. A.,N/A,N/A,N/A,N/A,With a Reservist in France,1917,N/A,N/A,N/A,N/A,N/A,N/A,N/A,N/A,N/A,Simple narrative of his service with Lancs Regiment in France WW1; Mons to Loos.,Reservist; Soldier,N/A,N/A,N/A,N/A
BOND,Jessie,N/A,N/A,N/A,N/A,Life and Reminiscences,1930,N/A,N/A,N/A,N/A,N/A,N/A,N/A,N/A,N/A,Cockney childhood; choir work in Liverpool; musical training; singing; her career in Gilbert and Sullivan operas.,Singer; Performer,N/A,N/A,N/A,N/A
BOND,Reginald C.,N/A,N/A,N/A,N/A,Prisoners,1934,N/A,N/A,N/A,N/A,N/A,N/A,N/A,N/A,N/A,Experiences in France WW1; Mons; capture; three years in German prisons; escape; Holland interment.,N/A,N/A,N/A,N/A,N/A
BONDFIELD,Margaret,N/A,N/A,N/A,N/A,A Life's Work,1949,N/A,N/A,N/A,N/A,N/A,N/A,N/A,N/A,N/A,Somerset; London shop girl; a career in trade union and labour movement; WW1; Russian diary; Parliamentary career; the cabinet; retirement & retrospect of 30's.,Trade Unionist; Politician,N/A,N/A,N/A,N/A
BONE,Sir David W.,N/A,N/A,N/A,N/A,Herch,1949,N/A,N/A,N/A,N/A,N/A,N/A,N/A,N/A,N/A,"His experiences as a merchant-seaman in sailing and steam ships and his services in WW2 transporting children to USA and troops to Mediterranean, French and Far Eastern theatres of war.",Merchant-Seaman,N/A,N/A,N/A,N/A
BONHAM,Colonel John,N/A,N/A,N/A,N/A,Oude in 1857,1928,N/A,N/A,N/A,N/A,N/A,N/A,N/A,N/A,N/A,Reminiscences of his service in Indian Mutiny; military affairs in outstations of Oude.,Colonel; Military,N/A,N/A,N/A,N/A
BONNEY,Thomas George,N/A,N/A,N/A,N/A,Memories,1921,N/A,N/A,N/A,N/A,N/A,N/A,N/A,N/A,N/A,"School; Cambridge; travels, climbing, geology; Victorian social life; Kingsley; daily life.",N/A,N/A,N/A,N/A,N/A
BONWICK,James,N/A,N/A,N/A,N/A,An Octogenarian's Reminiscences,1902,N/A,N/A,N/A,N/A,N/A,N/A,N/A,N/A,N/A,London boyhood and education; training and work as teacher.,Teacher,N/A,N/A,N/A,N/A
BOOTHBY,Laetitia,N/A,N/A,N/A,N/A,Memoirs,1872,N/A,N/A,N/A,N/A,N/A,N/A,N/A,N/A,N/A,"Theatrical life; Covent, Garden; Garrick; companion; intrigue; amours; it may be fiction.",Actress,N/A,N/A,N/A,N/A
BRDEN,Mary,N/A,N/A,N/A,N/A,Aley,1946,N/A,N/A,N/A,N/A,N/A,N/A,N/A,N/A,N/A,Novelist's experiences in France in early days of WW2; with a hospital unit in N. Africa.,Novelist,N/A,N/A,N/A,N/A
BORODIN,George,N/A,N/A,N/A,N/A,One Horizon,1948,N/A,N/A,N/A,N/A,N/A,N/A,N/A,N/A,N/A,"A doctor's world-wide travels, adventures and medical experiences, especially in the South Pacific.",Doctor,N/A,N/A,N/A,N/A
BORROW,George,N/A,N/A,N/A,N/A,Bible in Spain,1843,N/A,N/A,N/A,N/A,N/A,N/A,N/A,N/A,N/A,Experiences as agent of Bible Society; adventures with gypsies and Basques and troubles; prison reflections.,Agent,N/A,N/A,N/A,N/A
BOSANQUET,Augustus Henry,N/A,N/A,N/A,N/A,India Seventy Years Ago,1881,N/A,N/A,N/A,N/A,N/A,N/A,N/A,N/A,N/A,His boyhood in India; family life and sport; early service with East-India Co.,N/A,N/A,N/A,N/A,N/A
BOSTOCK,Edward Henry,N/A,N/A,N/A,N/A,Mensgeries,1927,N/A,N/A,N/A,N/A,N/A,N/A,N/A,N/A,N/A,"Bucks; life in circuses, menageries and theatres; tours throughout British Isles; anecdotes.",Manager,N/A,N/A,N/A,N/A
BOSTON,Themas,N/A,N/A,N/A,N/A,Memoirs,1776,N/A,N/A,N/A,N/A,N/A,N/A,N/A,N/A,N/A,Life and ministry at Ettrick; controversies in Church of Scotland.,Cleric,N/A,N/A,N/A,N/A
BOSWELL,John,N/A,N/A,N/A,N/A,Pig's Head,N/A,N/A,N/A,N/A,N/A,N/A,N/A,N/A,N/A,N/A,A partial autobiography of his fight against drink and work at the Birmingham Gospel P.L. Temperance Mission.,N/A,N/A,N/A,N/A,N/A
BOSWELL-STONE,Lucis Catherine,N/A,N/A,N/A,N/A,Memories,1895,N/A,N/A,N/A,N/A,N/A,N/A,N/A,N/A,N/A,"Dorchester; childhood & family life; townspeople; dreams and spiritualism; Dorchester people, customs and antiquities.",N/A,N/A,N/A,N/A,N/A
BOTELER,Captain John Harvey,N/A,N/A,N/A,N/A,Recollection,1883,N/A,N/A,N/A,N/A,N/A,N/A,N/A,N/A,N/A,"Pleasant record of his ships, his men, his naval career; and general account of sea life &c 18 Cent.",Navy Captain,N/A,N/A,N/A,N/A
BOTT,Alan John,N/A,N/A,N/A,N/A,With a Flyer during WW1,N/A,N/A,N/A,N/A,N/A,N/A,N/A,N/A,N/A,N/A,Experiences and adventures of a flyer during WW1; with RFC in France; early military air craft.,Flyer,N/A,N/A,N/A,N/A
BOOKER,Beryl Lee,N/A,N/A,N/A,N/A,Yesterday's Child,1937,N/A,N/A,N/A,N/A,N/A,N/A,N/A,N/A,N/A,"Derbyshire childhood and family life, 1890-1909; boarding schools; middle-class family piece.",N/A,N/A,N/A,N/A,N/A
BOON,John,N/A,N/A,N/A,N/A,Victorians,1928,N/A,N/A,N/A,N/A,N/A,N/A,N/A,N/A,N/A,"Journalist's work and reminiscences, 1883-1926; Times and Mail; Parliament; war; special correspondent; airs and public men.",Journalist,N/A,N/A,N/A,N/A
BOOSE,James R.,N/A,N/A,N/A,N/A,Memory Serving,1928,N/A,N/A,N/A,N/A,N/A,N/A,N/A,N/A,N/A,"Clerk, librarian, travelling commissioner; 50 years in Royal Colonial Institute; imperial affairs.",Clerk; Librarian,N/A,N/A,N/A,N/A
BOOSEY,William,N/A,N/A,N/A,N/A,Fifty Years,1931,N/A,N/A,N/A,N/A,N/A,N/A,N/A,N/A,N/A,"Music publishing with Boosey and Chappell, 1880-1939; London musical life and anecdotes.",Music Publisher,N/A,N/A,N/A,N/A
BOOTH,Doris Regina,N/A,N/A,N/A,N/A,"Mountains, Gold and Cannibals",1929,N/A,N/A,N/A,N/A,N/A,N/A,N/A,N/A,N/A,Gold mining with her husband in New Guinea in the 20's at Bulolo River; humanitarianism; her hospital work; travels.,N/A,N/A,N/A,N/A,N/A
BOOTH,John Bennion,N/A,N/A,N/A,N/A,Times Parade,N/A,N/A,N/A,N/A,N/A,N/A,N/A,N/A,N/A,N/A,Life and work as sporting journalist with 'The Pink 'Un'; racing and sport; music halls and theatre; Bohemian life and celebrities; anecdotes.,Sports Journalist,N/A,N/A,N/A,N/A
BOOTH,Mary Warburton,N/A,N/A,N/A,N/A,My Testimony,1947,N/A,N/A,N/A,N/A,N/A,N/A,N/A,N/A,N/A,Spiritual autobiography; religious life; social work in the London slums; mission work in India.,Social Worker,N/A,N/A,N/A,N/A
BOOTH,W. Bramwell,N/A,N/A,N/A,N/A,These Fifty Years,1929,N/A,N/A,N/A,N/A,N/A,N/A,N/A,N/A,N/A,"His Echoes & Memades parents and religious upbringing; life work and travels for Salvation Army; struggles and triumph; Rhodes, Stead, and famous churchmen.",N/A,N/A,N/A,N/A,N/A
BOOTHBY,Capt. Charles,N/A,N/A,N/A,N/A,A Prisoner in France,1698,N/A,N/A,N/A,N/A,N/A,N/A,N/A,N/A,N/A,Service in Peninsular War; at Talavera; capture; experiences in prison in France.,Captain,N/A,N/A,N/A,N/A
BOOTHBY,Com. Hubert Basil,N/A,N/A,N/A,N/A,N/A,1935,N/A,N/A,N/A,N/A,N/A,N/A,N/A,N/A,N/A,His life at sea 1878-1928; in merchant navy; R.N.R.; naval anecdotes and experiences in many parts of the world.,Commodore; Merchant Navy,N/A,N/A,N/A,N/A
BOTTLE,Dorothy M.,N/A,N/A,N/A,N/A,Reminiscences of a Queen's Army Schoolmistress,1936,N/A,N/A,N/A,N/A,N/A,N/A,N/A,N/A,N/A,"Work teaching soldiers' children; Ireland, Kent, Jamaica, Near East.",Schoolmistress,N/A,N/A,N/A,N/A
BOTTOME,Phyllis,N/A,N/A,N/A,N/A,Search for a Soul,1947,N/A,N/A,N/A,N/A,N/A,N/A,N/A,N/A,N/A,Psychologically frank account of childhood and family relations and their effect on her character.,N/A,N/A,N/A,N/A,N/A
BOTTQMLEY,Horatio William,N/A,N/A,N/A,N/A,Bottomley's Book,1909,N/A,N/A,N/A,N/A,N/A,N/A,N/A,N/A,N/A,His work in a lawyer's office; career in politics and M.P. for Hackney; activities among the London poor.,Lawyer; Politician; Member of Parliament,N/A,N/A,N/A,N/A
BOUGHTON,Capt. George Piper,N/A,N/A,N/A,N/A,Sea- Boy,1926,N/A,N/A,N/A,N/A,N/A,N/A,N/A,N/A,N/A,In sailing ships; the old sea life; pirates; South Seas; steamships; marvels & adventure.,Captain,N/A,N/A,N/A,N/A
BOULESTIN,Xavier Marcel,N/A,N/A,N/A,N/A,Self,1936,N/A,N/A,N/A,N/A,N/A,N/A,N/A,N/A,N/A,His early life in Perigord and Paris; nostalgic memories of artistic society & his discovery of London; London scene and society before WWI; work as interpreter in WWI; gastronomy and restaurants; writing; gossip.,N/A,N/A,N/A,N/A,N/A
BOULLIER,John A.,N/A,N/A,N/A,N/A,Jottings by a Gunner,1917,N/A,N/A,N/A,N/A,N/A,N/A,N/A,N/A,N/A,Methodist chaplain; gunner with RFA in France; chaplain with the infantry; WWI.,Chaplain; Gunner,N/A,N/A,N/A,N/A
BOULNOIS,Henry Percy,N/A,N/A,N/A,N/A,Reminiscences,1920,N/A,N/A,N/A,N/A,N/A,N/A,N/A,N/A,N/A,London childhood; King's College; engineering in Exeter and other towns; sanitary work.,Engineer,N/A,N/A,N/A,N/A
BOULTON,Alexander C. F.,N/A,N/A,N/A,N/A,Adventures,1939,N/A,N/A,N/A,N/A,N/A,N/A,N/A,N/A,N/A,"Canadian boyhood; legal work, journalism, politics in England; M.P., colonial interests; arbitration in N. England.",Politician; Lawyer; Journalist,N/A,N/A,N/A,N/A
BOURNE,Gilbert Charles,N/A,N/A,N/A,N/A,Memories,1933,N/A,N/A,N/A,N/A,N/A,N/A,N/A,N/A,N/A,School life at Eton in 70's; mostly deals with rowing.,N/A,N/A,N/A,N/A,N/A
BOURNE,Pamela,N/A,N/A,N/A,N/A,Out of the World,1935,N/A,N/A,N/A,N/A,N/A,N/A,N/A,N/A,N/A,"Her travels and adventures; New Zealand, Fiji, Tonga, Raratonga.",N/A,N/A,N/A,N/A,N/A
BOUTFLOWER,Andrew,N/A,N/A,N/A,N/A,Scenes,1916,N/A,N/A,N/A,N/A,N/A,N/A,N/A,N/A,N/A,Chorister at Manchester Cathedral; church life and religion; Tractarians.,Chorister,N/A,N/A,N/A,N/A
BOWATER,Sir William,N/A,N/A,N/A,N/A,Birmingham and I,1931,N/A,N/A,N/A,N/A,N/A,N/A,N/A,N/A,N/A,Business and public life in Birmingham; city life; politics; career of self-made man; Lord Mayor. Published in 'Evening Despatch'; cuttings in Birmingham Public Library.,Businessman; Politician,N/A,N/A,N/A,N/A
BOWDICH,Thomas Edward,N/A,N/A,N/A,N/A,Mission from Cape Coast Castle,1819,N/A,N/A,N/A,N/A,N/A,N/A,N/A,N/A,N/A,His embassy to Ashanti in 1817; court life; native customs on Gold Coast; diary.,N/A,N/A,N/A,N/A,N/A
BOWEN,Catherine S. D.,N/A,N/A,N/A,N/A,Friends and Fiddlers,1936,N/A,N/A,N/A,N/A,N/A,N/A,N/A,N/A,N/A,Pleasant memories of family life and amateur music.,N/A,N/A,N/A,N/A,N/A
BOWEN,Elizabeth,N/A,N/A,N/A,N/A,Seven Winters,1942,N/A,N/A,N/A,N/A,N/A,N/A,N/A,N/A,N/A,"Childhood in Dublin & County Cork, early century; education and family life; early impressions; a graceful record.",N/A,N/A,N/A,N/A,N/A
BOWEN,Stella,N/A,N/A,N/A,N/A,Drawn from Life,1941,N/A,N/A,N/A,N/A,N/A,N/A,N/A,N/A,N/A,Australian childhood; London art studies; painting in Sussex and France; expatriate artists and writers; life in London to 1940.,N/A,N/A,N/A,N/A,N/A
BOWER,Fred,N/A,N/A,N/A,N/A,Rolling Stonemason,1936,N/A,N/A,N/A,N/A,N/A,N/A,N/A,N/A,N/A,Liverpool boyhood; training as mason; work in Canada and USA; trade-unionism; Upton Sinclair; Jim Larkin; WWI; gold-digging in Australia.,Mason,N/A,N/A,N/A,N/A
BOWER,Frederick Orpen,N/A,N/A,N/A,N/A,Sixty Years,1938,N/A,N/A,N/A,N/A,N/A,N/A,N/A,N/A,N/A,"Repton; Cambridge; professor of botany; London, Glasgow; botanical scholars and studies, from 1875.",Professor of Botany,N/A,N/A,N/A,N/A
BOWER,Capt. Hamilton,N/A,N/A,N/A,N/A,Exploration Journal,1894,N/A,N/A,N/A,N/A,N/A,N/A,N/A,N/A,N/A,Exploring in Tibet; return via China; Tibetan life & customs; hardships.,Captain,N/A,N/A,N/A,N/A
BOWERS,Lt. William,N/A,N/A,N/A,N/A,Naval Adventures,1833,N/A,N/A,N/A,N/A,N/A,N/A,N/A,N/A,N/A,Boy at sea; travel and adventures and hardships of seaman's life; a cheerful record.,Lieutenant; Seaman,N/A,N/A,N/A,N/A
BOWES,John,N/A,N/A,N/A,N/A,Autobiography,1872,N/A,N/A,N/A,N/A,N/A,N/A,N/A,N/A,N/A,Conversion to Methodism; indefatigable travels and preaching; diary and articles.,Methodist Minister,N/A,N/A,N/A,N/A
BOWES,William,N/A,N/A,N/A,N/A,Express Deliveries,1949,N/A,N/A,N/A,N/A,N/A,N/A,N/A,N/A,N/A,"Cricketing memories and anecdotes of the Yorkshire & England fast bowler; games, players, and tours.",Cricketer,N/A,N/A,N/A,N/A
BOWKER,Archibald Edgar,N/A,N/A,N/A,N/A,Behind the Bar,1947,N/A,N/A,N/A,N/A,N/A,N/A,N/A,N/A,N/A,"Legal reminiscences; famous trials and lawyers; Marshall Hall; Birkett, etc.",Lawyer,N/A,N/A,N/A,N/A
BOWLER,Louis P.,N/A,N/A,N/A,N/A,Gold Co Palave,1911,N/A,N/A,N/A,N/A,N/A,N/A,N/A,N/A,N/A,Mining for diamonds and gold; railway construction; natives & settlers; from 1901.,Miner,N/A,N/A,N/A,N/A
BOWLES,Thomas Gibson,N/A,N/A,N/A,N/A,Flotsam and Jetsam,1882,N/A,N/A,N/A,N/A,N/A,N/A,N/A,N/A,N/A,"Personal life, reading and anecdotes, but mainly experiences as yachtsman.",Yachtsman,N/A,N/A,N/A,N/A
BOWMAN,Humphrey Ernest,N/A,N/A,N/A,N/A,Middle-East Window,1942,N/A,N/A,N/A,N/A,N/A,N/A,N/A,N/A,N/A,"His work in schools in Egypt, Sudan, Iraq, Palestine, 1903 to 1936; educational affairs.",Educator,N/A,N/A,N/A,N/A
BOWNAS,Seamus,N/A,N/A,N/A,N/A,Account of the Life,1756,N/A,N/A,N/A,N/A,N/A,N/A,N/A,N/A,N/A,"Autobiography of Westmoreland Quaker; ministry and travels in British Isles, West Indies, America.",Quaker Minister,N/A,N/A,N/A,N/A
BOWRING,Sir John,N/A,N/A,N/A,N/A,Autobiographical Recollections,1877,N/A,N/A,N/A,N/A,N/A,N/A,N/A,N/A,N/A,"Boyhood and early business life; Westminster Review & its contributors; politics, Parliament, public affairs; reminiscences of 4 celebrities in public life.",Politician; Writer,N/A,N/A,N/A,N/A
BOWYER,George W.,N/A,N/A,N/A,N/A,Lively Ahoy,n.d.,N/A,N/A,N/A,N/A,N/A,N/A,N/A,N/A,N/A,"Work as pilot and ship-builder for 58 years at Southampton, Copy Southampton Public Library.",Pilot; Ship-builder,N/A,N/A,N/A,N/A
BOWYER,William,N/A,N/A,N/A,N/A,Brought Out in Evidence,1941,N/A,N/A,N/A,N/A,N/A,N/A,N/A,N/A,N/A,"Summing-up at 50; reactions to public affairs & intellectual, spiritual, and political ideas of his time, with brief notes on everything in general.",N/A,N/A,N/A,N/A,N/A
BOX,Edward Gaspar,N/A,N/A,N/A,N/A,Of Time,1936,N/A,N/A,N/A,N/A,N/A,N/A,N/A,N/A,N/A,Winchester College in 50's; Fearon's House; school life; customs.,N/A,N/A,N/A,N/A,N/A
BOYD,Andrew Kennedy Hutchison,N/A,N/A,N/A,N/A,Twenty-Five Years,1892,N/A,N/A,N/A,N/A,N/A,N/A,N/A,N/A,N/A,His work as minister; parish work; social life in St. Andrews; the Church; education; literature; people.,Minister,N/A,N/A,N/A,N/A
BOYD,Donald,N/A,N/A,N/A,N/A,Salute of Guns,1930,N/A,N/A,N/A,N/A,N/A,N/A,N/A,N/A,N/A,"Good personal narrative of artillery officer in France, WWI; Somme, Ypres, 1918 offensive.",Artillery Officer,N/A,N/A,N/A,N/A
BOYD,Frank M.,N/A,N/A,N/A,N/A,Pelican's Tale,1919,N/A,N/A,N/A,N/A,N/A,N/A,N/A,N/A,N/A,"St. Andrews; 50 years as journalist in London, etc.; sporting journalism; The Pelican; Bohemian London; clubs; theatres.",Journalist,N/A,N/A,N/A,N/A
BOYD,Joyce,N/A,N/A,N/A,N/A,My Farm in Lion Countyy,1933,N/A,N/A,N/A,N/A,N/A,N/A,N/A,N/A,N/A,Her farming experiences after WW in Tangenyika; family and domestic affairs; social life; gardening; lions and adventures.,N/A,N/A,N/A,N/A,N/A
BOYD,Mark,N/A,N/A,N/A,N/A,Reminiscences of Fift: Years,1871,N/A,N/A,N/A,N/A,N/A,N/A,N/A,N/A,N/A,Politics and politicians from Pitt onwards; largely Scottish; 4 Campbell the poet; celebrities.,N/A,N/A,N/A,N/A,N/A
BOYD,Martin,N/A,N/A,N/A,N/A,Single Flame,1939,N/A,N/A,N/A,N/A,N/A,N/A,N/A,N/A,N/A,"Boyhood hopes contrasted with experience; ideals, religion & disillusionment in war; politics; writing.",N/A,N/A,N/A,N/A,N/A
