author1_last_name,author1_first_name,author2_last_name,author2_first_name,editor1_last_name,editor1_first_name,title,original_date_of_publication,second_or_later_date_of_publication,volume,publisher,publisher_location,number_of_pages,dictation,name_of_transcriber,translation,name_of_translator,summary,occupations,date_of_birth,date_of_death,place_of_birth,other_places_lived
COTTON,Rt. Rev. George Edward,N/A,N/A,N/A,N/A,Memoir,1871,N/A,N/A,N/A,N/A,N/A,N/A,N/A,N/A,N/A,"Religious diaries, 1858-66; educational, administrative and religious work as Bishop of Calcutta; social life; & his earlier years in education; teaching at Rugby and Marlborough; Arnold.",Bishop; Educator,N/A,N/A,N/A,N/A
COTTON,Sir Henry,N/A,N/A,N/A,N/A,Indian and Home Memories,1911,N/A,N/A,N/A,N/A,N/A,N/A,N/A,N/A,N/A,His thirty-five years in the Indian Civil Service; politics and administration; some social life and sport.,Civil Servant,N/A,N/A,N/A,N/A
COTTON,Sir Sydney John,N/A,N/A,N/A,N/A,Nine Years on the North-West Frontier,N/A,N/A,N/A,N/A,N/A,N/A,N/A,N/A,N/A,N/A,"Military service, administration, and sport; the Mutiny.",Military,N/A,N/A,N/A,N/A
COTTON,William,N/A,N/A,N/A,N/A,Certain Reminiscences,N/A,N/A,N/A,N/A,N/A,N/A,N/A,N/A,N/A,N/A,"Anecdotes of artists and writers, national events, theatre, social happenings, first half 19th Century.",N/A,N/A,N/A,N/A,N/A
COULTON,George Gordon,N/A,N/A,N/A,N/A,Fourscore Years,1943,N/A,N/A,N/A,N/A,N/A,N/A,N/A,N/A,N/A,Boyhood in Lynn; Felstead school; Cambridge; school teaching; professor of history Cambridge; scholarship and study; colleagues and students; his historical writings; the mellow record of one of the last Eminent Victorians.,Professor; Historian,N/A,N/A,N/A,N/A
COUNSEL,Dr. Herbert E.,N/A,N/A,N/A,N/A,The Broad,1943,N/A,N/A,N/A,N/A,N/A,N/A,N/A,N/A,N/A,London; Guy's Hospital; practice in Oxford from 1897; Jowett and other celebrities; student life; the OUDS; European travels.,Doctor,N/A,N/A,N/A,N/A
N/A,A COUNTRY VICAR,N/A,N/A,Hodgson,Randolph,Memories and Boyhood,1930,N/A,N/A,N/A,N/A,N/A,N/A,N/A,N/A,N/A,"Second innings and village cricket; Lord's; county, varsity, and Test cricket; reprinted from The Cricketer.",Vicar,N/A,N/A,N/A,N/A
COURNOS,John,N/A,N/A,N/A,N/A,Autobiography,1935,N/A,N/A,N/A,N/A,N/A,N/A,N/A,N/A,N/A,Novelist's childhood in Russia; emigration to USA; career as novelist and writer in London from 1912.,Novelist,N/A,N/A,N/A,N/A
COURTENAY,Arthur,N/A,N/A,N/A,N/A,Autobiography and letters,1834,N/A,N/A,N/A,N/A,N/A,N/A,N/A,N/A,N/A,Diplomatic and social life in India; sentimental affairs; it may be fiction.,Diplomat,N/A,N/A,N/A,N/A
COURTENAY,William,N/A,N/A,N/A,N/A,Airman Friday,1937,N/A,N/A,N/A,N/A,N/A,N/A,N/A,N/A,N/A,Bellhop on liners; WWI service as a flyer in Egypt and near East; civilian pilot; developments in civil aviation; lecturing; journalism.,Pilot; Journalist,N/A,N/A,N/A,N/A
COURTHOPE,Sir George,N/A,N/A,N/A,N/A,Memoirs,1907,N/A,N/A,N/A,N/A,N/A,N/A,N/A,N/A,N/A,"Travels in Italy, France, Turkey and public work; anti-catholic; financial officer during Commonwealth; Parliament; Restoration.",N/A,N/A,N/A,N/A,N/A
COURTLAND,Arthur C.,N/A,N/A,N/A,N/A,Notes of a Wayfarer,1904,N/A,N/A,N/A,N/A,N/A,N/A,N/A,N/A,N/A,"Items from his social life, friendships, social work & domestic life.",N/A,N/A,N/A,N/A,N/A
COURTNEIDGE,Robert,N/A,N/A,N/A,N/A,I Was an Actor Once,1930,N/A,N/A,N/A,N/A,N/A,N/A,N/A,N/A,N/A,"Career as actor and manager; London theatre, actors, theatrical life; anecdotes.",Actor; Manager,N/A,N/A,N/A,N/A
COURTNEY,Janet Elizabeth,N/A,N/A,N/A,N/A,Re-ared in Tranquillity,1926,N/A,N/A,N/A,N/A,N/A,N/A,N/A,N/A,N/A,"Childhood in country; clerical life in Lincoln and Oxford from 70's; work as clerk, teacher, journalist; WWI.",Clerk; Teacher; Journalist,N/A,N/A,N/A,N/A
COURTNEY,Roger,N/A,N/A,N/A,N/A,The Claws of Africa,1934,N/A,N/A,N/A,N/A,N/A,N/A,N/A,N/A,N/A,"His varied jobs in Central Africa; store-clerk, ranger on a timber concession, professional hunter, and guide; anecdotes.",Hunter; Guide,N/A,N/A,N/A,N/A
COURTNEY,William Leonard,N/A,N/A,N/A,N/A,Passing Hour,1925,N/A,N/A,N/A,N/A,N/A,N/A,N/A,N/A,N/A,Bath; Oxford; work as a London journalist; literature and the theatre in London.,Journalist,N/A,N/A,N/A,N/A
COUSINS,Dennis Lewis,N/A,N/A,N/A,N/A,Extracts from the Diary,1847,N/A,N/A,N/A,N/A,N/A,N/A,N/A,N/A,N/A,Workhouse chaplain in 40's; case histories; religious and social conditions; repentances.,Chaplain,N/A,N/A,N/A,N/A
COUSTOS,John,N/A,N/A,N/A,N/A,The Sufferings,1746,N/A,N/A,N/A,N/A,N/A,N/A,N/A,N/A,N/A,Freemason's experiences with Inquisition at Lisbon; imprisonment; torture and four years in galleys; release by intercession of George II.,Freemason,N/A,N/A,N/A,N/A
COWAN,Charles,N/A,N/A,N/A,N/A,Reminiscences,1878,N/A,N/A,N/A,N/A,N/A,N/A,N/A,N/A,N/A,"Social life, politics, travel; Switzerland; Reform Bill, Corn laws; USA.",N/A,N/A,N/A,N/A,N/A
COWAN,Gibson,N/A,N/A,N/A,N/A,Loud Report,1938,N/A,N/A,N/A,N/A,N/A,N/A,N/A,N/A,N/A,"Working-class life & poverty, London; his odd jobs and work as a showman and in the theatre.",Showman; Theatre worker,N/A,N/A,N/A,N/A
COWAN,John James,N/A,N/A,N/A,N/A,From 1846 to 1932,1933,N/A,N/A,N/A,N/A,N/A,N/A,N/A,N/A,N/A,"Edinburgh; St. Andrew's; Scottish residence and world-wide travels; books, art, theatre, pastimes, Oxford Group; WWI.",N/A,N/A,N/A,N/A,N/A
COWAN,Samuel,N/A,N/A,N/A,N/A,Humorous in the Life,1913,N/A,N/A,N/A,N/A,N/A,N/A,N/A,N/A,N/A,"His work in Inland Revenue and newspaper office; newspaper editor in Scotland; Liberal agent in Perth; printing, journalism, politics, Scottish affairs.",Inland Revenue; newspaper editor; Liberal agent; journalist,N/A,N/A,N/A,N/A
COWARD,Henry (Sir),N/A,N/A,N/A,N/A,Reminiscences,1919,N/A,N/A,N/A,N/A,N/A,N/A,N/A,N/A,N/A,Self-help; apprentice and workman in cutlery factory; amateur music and teaching in Sheffield; career as choral conductor; editor.,Choral conductor; editor; apprentice; workman,N/A,N/A,N/A,N/A
COWTAN,Robert,N/A,N/A,N/A,N/A,"""Man of Kent""",186,N/A,N/A,N/A,N/A,N/A,N/A,N/A,N/A,N/A,Life in Canterbury in the twenties; Kentish life and people; religion; his work in London.,N/A,N/A,N/A,N/A,N/A
COX,Alfred,N/A,N/A,N/A,N/A,the Doctors,1937,N/A,N/A,N/A,N/A,N/A,N/A,N/A,N/A,N/A,Childhood in theatre and difficulties with education; poverty and fortunes as actor and playwright; Medical training; success-ful career; work as secretary of the BMA; medical celebrities.,Actor; playwright; secretary of BMA,N/A,N/A,N/A,N/A
COX,Sir Edmund Charles,N/A,N/A,N/A,N/A,My Thirty Years in India,1909,N/A,N/A,N/A,N/A,N/A,N/A,N/A,N/A,N/A,His work as a tea-planter and in the educational and police services; adventures; sport and social life.,Tea-planter; educator; police service,N/A,N/A,N/A,N/A
COWELL,Elizabeth B.,N/A,N/A,N/A,N/A,Leaves of Memory,1892,N/A,N/A,N/A,N/A,N/A,N/A,N/A,N/A,N/A,"Girlhood in Ossington; her social life; travels in France, Italy, and India; meditations; love of nature; partly done in verse.",N/A,N/A,N/A,N/A,N/A
COWELL,George,N/A,N/A,Ruth Cowell,N/A,Memorable Life,1895,N/A,N/A,N/A,N/A,N/A,N/A,N/A,N/A,N/A,Includes diaries of religious life of lay preacher and writer; mid 19th century.,Lay preacher; writer,N/A,N/A,N/A,N/A
COWELL,Henry J.,N/A,N/A,N/A,N/A,These Forty Years,1940,N/A,N/A,N/A,N/A,N/A,N/A,N/A,N/A,N/A,"Life and work; Baptist Free Church; Times; Free activities; WWI and subeditor, politics; historical value.",Baptist; subeditor,N/A,N/A,N/A,N/A
COWTAN,Robert,N/A,N/A,N/A,N/A,Of the British Museum,1872,N/A,N/A,N/A,N/A,N/A,N/A,N/A,N/A,N/A,"Employment in Museum library from 1835; happenings and changes there; Ellis, Panizzi & other librarians.",Librarian,N/A,N/A,N/A,N/A
COX,Capt. Hiram,N/A,N/A,N/A,N/A,Military Journal,1796-97,N/A,N/A,N/A,N/A,N/A,N/A,N/A,N/A,N/A,Service with the East India Company's forces at Amarapoorah; Burmese court life; Burmese customs.,Military service,N/A,N/A,N/A,N/A
COWEN,Frederic Hyman (Sir),N/A,N/A,N/A,N/A,My Friends,1913,N/A,N/A,N/A,N/A,N/A,N/A,N/A,N/A,N/A,Musical career from 1856; studies in England and Germany; composer and opera conductor; life at London Philharmonic.,Composer; opera conductor,N/A,N/A,N/A,N/A
COXON,Stanley Williams,N/A,N/A,N/A,N/A,And That Reminds Me,1915,N/A,N/A,N/A,N/A,N/A,N/A,N/A,N/A,N/A,"Commander's memories of a life at sea; with marines and police in Andamans, India, Burma, Australia.",Commander; military service,N/A,N/A,N/A,N/A
COXWELL,Henry Tracey,N/A,N/A,N/A,N/A,Balloon Experiences,1887,N/A,N/A,N/A,N/A,N/A,N/A,N/A,N/A,N/A,Experiments and adventures; work for government; shows; ascents in 60's and 70's.,Aeronaut; government worker,N/A,N/A,N/A,N/A
COZENS,Charles,N/A,N/A,N/A,N/A,Adventures,1848,N/A,N/A,N/A,N/A,N/A,N/A,N/A,N/A,N/A,Black sheep; school; Cambridge; joins Horse Guards; transportation; convict life in New South Wales; work there as policeman and tax collector; return to Wales in 1846.,Policeman; tax collector,N/A,N/A,N/A,N/A
CRADOCK,Joseph,N/A,N/A,N/A,N/A,Literary and Miscellaneous Memoirs,1828,N/A,N/A,N/A,N/A,N/A,N/A,N/A,N/A,N/A,Memories of antiquarian and eccentric; theatres & literature; antiquities; his eminent friends; travel; country life.,Antiquarian; writer,N/A,N/A,N/A,N/A
CRAIG,C. W. Thurlow,N/A,N/A,N/A,N/A,A Rebel for a Hope,1934,N/A,N/A,N/A,N/A,N/A,N/A,N/A,N/A,N/A,Life at Sao Paulo; his experiences as a rebel horseman during the Chaco War; 1932 revolution.,Rebel horseman,N/A,N/A,N/A,N/A
CRAIN,Charles Paston,N/A,N/A,N/A,N/A,Memories of a Resident Magistrate,1938,N/A,N/A,N/A,N/A,N/A,N/A,N/A,N/A,N/A,"A Yorkshire boyhood; Irish magistrate, 1880-1920; Killarney, Sligo and Kerry; Irish life and politics; service in Boer War.",Magistrate,N/A,N/A,N/A,N/A
CRAWFCORD,Abraham (Capt.),N/A,N/A,N/A,N/A,Reminiscences of a Naval Officer,1851,N/A,N/A,N/A,N/A,N/A,N/A,N/A,N/A,N/A,"Irish childhood; naval career as boy and officer during Peninsular War, 1800-15; anecdotes of officers, etc.",Captain; Naval Officer,N/A,N/A,N/A,N/A
CRAWFORD,Allan B.,N/A,N/A,N/A,N/A,I Went to Tristan,1941,N/A,N/A,N/A,N/A,N/A,N/A,N/A,N/A,N/A,His adventures during & scientific expedition; life and ways of the slanders.,N/A,N/A,N/A,N/A,N/A
CRAWFORD,Archibald,N/A,N/A,N/A,N/A,Guilty as Libeled!,1938,N/A,N/A,N/A,N/A,N/A,N/A,N/A,N/A,N/A,Career as criminal lawyer; work in Scottish courts; criminal psychology.,Criminal lawyer,N/A,N/A,N/A,N/A
CRAWFORD,Arthur Travers,N/A,N/A,Arthur,T.C.,Reminiscences of an Indian Police Officer,1894,N/A,N/A,N/A,N/A,N/A,N/A,N/A,N/A,N/A,"Police work in India from 1850; Bombay; crime, thugs dacoits; Mutiny; famines; social life and anecdotes.",Police Officer,N/A,N/A,N/A,N/A
CRAWFCRD,Daniel,N/A,N/A,N/A,N/A,Black,1912,N/A,N/A,N/A,N/A,N/A,N/A,N/A,N/A,N/A,His life and missionary work in affairs.,Missionary,N/A,N/A,N/A,N/A
CREIGHTON,Oswin,N/A,N/A,N/A,N/A,With the Twenty-Ninth Division,1916,N/A,N/A,N/A,N/A,N/A,N/A,N/A,N/A,N/A,"Chaplain's experiences at Gallipoli, WW1.",Chaplain,N/A,N/A,N/A,N/A
CREMER,John,N/A,N/A,N/A,N/A,Ramblin' Jack,1936,N/A,N/A,N/A,N/A,N/A,N/A,N/A,N/A,N/A,Amusing account of life in navy and in merchant ships 1708-30; excellent detail of ordinary sailor's life; humor and pathos; interesting language.,Navy; Merchant sailor,N/A,N/A,N/A,N/A
CRESSWELL,Gerard (Mrs.),N/A,N/A,N/A,N/A,Eighteen state,N/A,N/A,N/A,N/A,N/A,N/A,N/A,N/A,N/A,N/A,Farming in Norfolk with husband and alone; Royal landlord and society; work; difficulties with huntsmen; independent and vigorous account of work and views.,N/A,N/A,N/A,N/A,N/A
CRESSWELL,Walter D'Arcy,N/A,N/A,N/A,N/A,The Poet's Progress,1930,N/A,N/A,N/A,N/A,N/A,N/A,N/A,N/A,N/A,New Zealand; service in WW1; difficulties in England; door to door selling of poetry; critical & literary views; unusual.,Poet; Soldier,N/A,N/A,N/A,N/A
CRESTON,Dormer (Dorothy J. Baynes),N/A,N/A,N/A,N/A,Enter a Child,1939,N/A,N/A,N/A,N/A,N/A,N/A,N/A,N/A,N/A,Childhood in London and Wiltshire; delighted account of a golden childhood; country house life in distinguished company.,N/A,N/A,N/A,N/A,N/A
CRESWICK,William,N/A,N/A,N/A,N/A,An Autobiography,1886,N/A,N/A,N/A,N/A,N/A,N/A,N/A,N/A,N/A,Theatrical career 1835-85; in London and provinces; Australian tour anecdotes of famous actors.,Theatrical Actor,N/A,N/A,N/A,N/A
CRICHTON,Kate,N/A,N/A,N/A,N/A,Six Years in Italy,1861,N/A,N/A,N/A,N/A,N/A,N/A,N/A,N/A,N/A,"Social life and travel in the 50's; music, politics, religion.",N/A,N/A,N/A,N/A,N/A
CRICHTON,Miss Makgill,N/A,N/A,N/A,N/A,Recollections of My Early Scottish Home,1876,N/A,N/A,N/A,N/A,N/A,N/A,N/A,N/A,N/A,"Early life and hardships, village friends; a trip to St. Andrew's; early 19th Century.",N/A,N/A,N/A,N/A,N/A
CRICHTON-EROWNE,Sir James,N/A,N/A,N/A,N/A,Victorian Jottings,1926,N/A,N/A,N/A,N/A,N/A,N/A,N/A,N/A,N/A,"A famous physician's student career and reminiscences; Edinburgh; work in Yorkshire, London; memories of doctors and medicine, celebrities in science and the arts.",Physician,N/A,N/A,N/A,N/A
CRAWFORD,E. May,N/A,N/A,N/A,N/A,By the Equator's Snowy Peak,1913,N/A,N/A,N/A,N/A,N/A,N/A,N/A,N/A,N/A,"Medical missionary work with her husband in Uganda, from 1904; native life; travels.",Medical Missionary,N/A,N/A,N/A,N/A
CRAWFORD,James H.,N/A,N/A,N/A,N/A,Autobiography of a Tramp,1900,N/A,N/A,N/A,N/A,N/A,N/A,N/A,N/A,N/A,Experiences with his parents; tramp from boyhood; people & places; travel; adventures.,Tramp,N/A,N/A,N/A,N/A
CRAWFORD,John Dawson,N/A,N/A,N/A,N/A,Reflections and Recollections,1936,N/A,N/A,N/A,N/A,N/A,N/A,N/A,N/A,N/A,Ireland; the career and cases of lawyer and judge; Northern circuit in Liverpool; county court work.,Lawyer; Judge,N/A,N/A,N/A,N/A
CRAWFORD,Robert John,N/A,N/A,N/A,N/A,I Was an 8th Army Soldier,1944,N/A,N/A,N/A,N/A,N/A,N/A,N/A,N/A,N/A,Dictated autobiography of driver's experiences in WW2; with Montgomery in Africa; a grim and humorous narrative.,Soldier,N/A,N/A,N/A,N/A
CRAWFURD,John,N/A,N/A,N/A,N/A,Brief Narrative of a Resident at the Javanese Court,1828,N/A,N/A,N/A,N/A,N/A,N/A,N/A,N/A,N/A,Services on embassy from Governor of India to Siam and Cochin-China and later to Court of Ava.,Resident; Diplomat,N/A,N/A,N/A,N/A
CRAWSHAY-WILLIAMS,Eliot,N/A,N/A,N/A,N/A,Notebook,1918,N/A,N/A,N/A,N/A,N/A,N/A,N/A,N/A,N/A,Experiences WW1; France and Sinai campaign; M.P. Leicester and political life; marriage; his novels writing for theatre and films.,MP; Novelist,N/A,N/A,N/A,N/A
CREAGH,Sir Garrett O'Moore,N/A,N/A,N/A,N/A,Autobiography,1924,N/A,N/A,N/A,N/A,N/A,N/A,N/A,N/A,N/A,"Army career, mostly in India; 1866-1916; Afghan war; India Office; commander-in-chief in India.",General,N/A,N/A,N/A,N/A
CREEVEY,Thomas,N/A,N/A,Maxwell,Sir H.,The C; ey Papers,1850,N/A,N/A,N/A,N/A,N/A,N/A,N/A,N/A,N/A,"Reminiscences of political life, high society and court; Prince Regent, Wellington; spicy gossip; the early 19th century.",Political figure,N/A,N/A,N/A,N/A
CREICHTON,John (Capt.),N/A,N/A,N/A,N/A,Memoirs,1731,N/A,N/A,N/A,N/A,N/A,N/A,N/A,N/A,N/A,Military service and adventures; the Old Pretender; Jacobites and Scottish.,Captain; Military service,N/A,N/A,N/A,N/A
CROFTS,Charley,N/A,N/A,N/A,N/A,Memoirs,1829,N/A,N/A,N/A,N/A,N/A,N/A,N/A,N/A,N/A,"Autobiography of a Paddy; army life in Ireland; rake, humorist, good fellow; his troubles; amusing tales.",Soldier,N/A,N/A,N/A,N/A
CROKE,Charles,N/A,N/A,N/A,N/A,Fortune's Uncertainty,1667,N/A,N/A,N/A,N/A,N/A,N/A,N/A,N/A,N/A,"Wild oats of a young Oxford scholar; picaresque adventures, England, Virginia, Portugal; escapades and loves.",Scholar,N/A,N/A,N/A,N/A
CROKER,John,N/A,N/A,N/A,N/A,Brief Memoir,1850,N/A,N/A,N/A,N/A,N/A,N/A,N/A,N/A,N/A,"Short account of life and ministry of a Plymouth Quaker; religious life & travel, England, America.",Quaker,N/A,N/A,N/A,N/A
CROLL,James,N/A,N/A,N/A,N/A,Autobiographical Sketch,1896,N/A,N/A,N/A,N/A,N/A,N/A,N/A,N/A,N/A,Stonemason's son; Scottish education; village life; odd jobs; reading and study; geological work; civil service in Edinburgh; science.,Stonemason; Scientist,N/A,N/A,N/A,N/A
CROMAR,John,N/A,N/A,N/A,N/A,Jock of the Island,1935,N/A,N/A,N/A,N/A,N/A,N/A,N/A,N/A,N/A,Voyages and adventures of a trader and labour recruiter in Solomons.,Trader,N/A,N/A,N/A,N/A
CROMER,"Ruby F. M. Bar, Countess of",N/A,N/A,N/A,N/A,Such Were These Years,1939,N/A,N/A,N/A,N/A,N/A,N/A,N/A,N/A,N/A,"Her life and travels with her husband; in Palestine, India, Canada; society and politics in England while her husband was Lord Chamberlain.",Countess; Society figure,N/A,N/A,N/A,N/A
CROMPTON,Col. Rookes E. B.,N/A,N/A,N/A,N/A,Reminiscences,1928,N/A,N/A,N/A,N/A,N/A,N/A,N/A,N/A,N/A,"Army career in India, Boer War, WW1; transport; work as electrical engineer, Italy, Balkans and Sweden; celebrities.",Colonel; Engineer,N/A,N/A,N/A,N/A
CROOK,David Moore,N/A,N/A,N/A,N/A,Spitfire Pilot,1942,N/A,N/A,N/A,N/A,N/A,N/A,N/A,N/A,N/A,Training as flyer; experiences in Battle of Britain.,Pilot,N/A,N/A,N/A,N/A
CROOK,John,N/A,N/A,N/A,N/A,A Short History of the Life,1706,N/A,N/A,N/A,N/A,N/A,N/A,N/A,N/A,N/A,A Hertford man's life as a Quaker in the 17th Century; religion; his sufferings in ministry.,Quaker,N/A,N/A,N/A,N/A
CROPTON,John,N/A,N/A,N/A,N/A,Road to Nowhere,1936,N/A,N/A,N/A,N/A,N/A,N/A,N/A,N/A,N/A,Boyhood romance and dreams; soldiering in WW1; Gallipoli; post-war failures and disillusionment.,Soldier,N/A,N/A,N/A,N/A
CROSLAND,Newton Camilla (Mrs.),N/A,N/A,N/A,N/A,Landmarks of a Literary Life,1893,N/A,N/A,N/A,N/A,N/A,N/A,N/A,N/A,N/A,N/A,Literary figure,N/A,N/A,N/A,N/A
CRICK,Throne,N/A,N/A,N/A,N/A,Sketches from the Diary,1847,N/A,N/A,N/A,N/A,N/A,N/A,N/A,N/A,N/A,Travels and events in the life of a commercial traveller; hotels and travel conditions; people.,Commercial Traveller,N/A,N/A,N/A,N/A
CRISP,Dorothy,N/A,N/A,N/A,N/A,A Life for England,1946,N/A,N/A,N/A,N/A,N/A,N/A,N/A,N/A,N/A,Incidents in life of a publicist and publisher; her struggles to revive Conservative Party.,Publicist; Publisher,N/A,N/A,N/A,N/A
CRISP,Margaret,N/A,N/A,N/A,N/A,Utility Nurse,1947,N/A,N/A,N/A,N/A,N/A,N/A,N/A,N/A,N/A,"Volunteer Red Cross Nurse 1942-45; her work, comrades, friends; the hospital system; air raids.",Volunteer Nurse,N/A,N/A,N/A,N/A
CRISP,Stephen,N/A,N/A,N/A,N/A,A Memorable Account,N/A,N/A,N/A,N/A,N/A,N/A,N/A,N/A,N/A,N/A,"Spiritual autobiography of an early Quaker; ministry, sufferings and controversy; inner light.",Quaker,N/A,N/A,N/A,N/A
CRISPE,Thomas Edward,N/A,N/A,N/A,N/A,Reminiscences,1910,N/A,N/A,N/A,N/A,N/A,N/A,N/A,N/A,N/A,"Childhood; legal training and career; King's Counsel; judges, lawyers and trials; life in London.",Lawyer; King's Counsel,N/A,N/A,N/A,N/A
CRISTY,Theodore,N/A,N/A,N/A,N/A,My Ups and Downs,1937,N/A,N/A,N/A,N/A,N/A,N/A,N/A,N/A,N/A,Sporting life of an amateur Jockey and master of staghounds.,Jockey; Staghound Master,N/A,N/A,N/A,N/A
CRITTALL,Francis Henry,N/A,N/A,N/A,N/A,Fifty Years,1934,N/A,N/A,N/A,N/A,N/A,N/A,N/A,N/A,N/A,Nonconformist; schooling; his work as plumber and window-maker; success story; social experiments in his business; munitions work WWI; a simple account of business life.,Plumber; Window-maker,N/A,N/A,N/A,N/A
CROAL,David,N/A,N/A,N/A,N/A,Early Recollections,1898,N/A,N/A,N/A,N/A,N/A,N/A,N/A,N/A,N/A,Journalist's experiences in Edinburgh and Glasgow 1832-59; his work as reporter; editors and journalists; local life; Crimean War.,Journalist,N/A,N/A,N/A,N/A
CROFT,"Henry Page Croft, Baron",N/A,N/A,N/A,N/A,My Life of Strife,1917,N/A,N/A,N/A,N/A,N/A,N/A,N/A,N/A,N/A,"Member of Parliament in Territorials WWI; Western Front; the Somme; political career in Commons; & Under-Secretary of State for War, WWII; public affairs.",Member of Parliament; Under-Secretary of State for War,N/A,N/A,N/A,N/A
CROFT-COOKE,Rupert,N/A,N/A,N/A,N/A,The Circus,1941,N/A,N/A,N/A,N/A,N/A,N/A,N/A,N/A,N/A,Youth in Buenos Aires; teaching English; Argentinian life; experiences in social and literary affairs.,Writer; Teacher,N/A,N/A,N/A,N/A
CROSLAND,Newton,N/A,N/A,N/A,N/A,Rambles Round My Life,1898,N/A,N/A,N/A,N/A,N/A,N/A,N/A,N/A,N/A,"America, Montreal; youth on Wilts farm; clerk in London; literature, philosophy, spiritualism; marriage and social life; views on Darwin; travels in France; celebrities.",Clerk; Writer,N/A,N/A,N/A,N/A
CROSS,George,N/A,N/A,N/A,N/A,Suffolk Punch,1939,N/A,N/A,N/A,N/A,N/A,N/A,N/A,N/A,N/A,"Suffolk family; his successful career in business, commencing as a butcher; real estate; his creed.",Butcher; Businessman,N/A,N/A,N/A,N/A
CROSS,John Keir,N/A,N/A,N/A,N/A,Aspect of Life,1937,N/A,N/A,N/A,N/A,N/A,N/A,N/A,N/A,N/A,"Lanarkshire; a clerk in Perth; actor, atheist, ventriloquist; attempted suicide; travels and adventures; Eastern religion and the evolution of his creed.",Clerk; Actor,N/A,N/A,N/A,N/A
CROSS,Thomas,N/A,N/A,N/A,N/A,Stage Coachman,"1861, 1904",N/A,N/A,N/A,N/A,N/A,N/A,N/A,N/A,N/A,"His work as coachman, London and South; social scene, customs, travel conditions and his passengers.",Coachman,N/A,N/A,N/A,N/A
CROSS,William,N/A,N/A,Hunt,John,Diary,1846,N/A,N/A,N/A,N/A,N/A,N/A,N/A,N/A,N/A,Wesleyan Methodist's missionary work; Friendly Islands and Fijis; conversion and backslidings of natives.,Missionary,N/A,N/A,N/A,N/A
CROTCH,William,N/A,N/A,N/A,N/A,Memoirs of a Norfolk musician,N/A,N/A,N/A,N/A,N/A,N/A,N/A,N/A,N/A,N/A,Experiences in early days of Quaker movement during Restoration; Quakers and their sufferings.,Musician,N/A,N/A,N/A,N/A
CROUCH,Archer Philip,N/A,N/A,N/A,N/A,Diary,1886,N/A,N/A,N/A,N/A,N/A,N/A,N/A,N/A,N/A,Experiences with laying a cable; West coast of Africa; traders and natives.,Cable Laying Worker,N/A,N/A,N/A,N/A
CROUCH,Emma Elizabeth,N/A,N/A,N/A,N/A,Memoirs of Cora Pearl,1886,N/A,N/A,N/A,N/A,N/A,N/A,N/A,N/A,N/A,Plymouth girl's adventures and profligacy in France; courtesan's scandals; translated from French.,Courtesan,N/A,N/A,N/A,N/A
CROUCH,William,N/A,N/A,N/A,N/A,Posthuma Christiana,1712,N/A,N/A,N/A,N/A,N/A,N/A,N/A,N/A,N/A,Experiences in early days of Quaker movement during Restoration; Quakers and their sufferings.,Quaker,N/A,N/A,N/A,N/A
CROW,Capt. Hugh,N/A,N/A,N/A,N/A,Memoirs,1830,N/A,N/A,N/A,N/A,N/A,N/A,N/A,N/A,N/A,A slave-trader's voyages and adventures; imprisonment in France; slave trade in Africa and West Indies; an interesting apologia.,Slave Trader,N/A,N/A,N/A,N/A
CROWE,Sir Joseph Archer,N/A,N/A,N/A,N/A,Reminiscences,1895,N/A,N/A,N/A,N/A,N/A,N/A,N/A,N/A,N/A,"Journalist's experiences 1830-65; Daily News; Times; war correspondent; Crimea, Indian Mutiny and Germany.",Journalist,N/A,N/A,N/A,N/A
CROWLEY,Aleister (Edward Alexander),N/A,N/A,N/A,N/A,The Confessions,1930,N/A,N/A,N/A,N/A,N/A,N/A,N/A,N/A,N/A,Childhood among Plymouth Brethren; school and Cambridge; sport; climbing; marriage; his writing; experience in magic and spiritualism.,Occultist; Writer,N/A,N/A,N/A,N/A
CROWLEY,Ann,N/A,N/A,N/A,N/A,Religious Experience,1842,N/A,N/A,N/A,N/A,N/A,N/A,N/A,N/A,N/A,"Quaker spiritual life and ministry, Southern counties, from 1791; Gurneys.",Quaker Minister,N/A,N/A,N/A,N/A
CROWTHER,Samuel,N/A,N/A,TAYLOR,John Christopher,Diary,N/A,N/A,N/A,N/A,N/A,N/A,N/A,N/A,N/A,N/A,Missionary travels; Niger expedition of Church Missionary Society; native life and customs.,Missionary,N/A,N/A,N/A,N/A
CROXTON,Arthur,N/A,N/A,N/A,N/A,Crowded Nights,1934,N/A,N/A,N/A,N/A,N/A,N/A,N/A,N/A,N/A,Lancashire; journalism in Manchester and London; weeklies; advertising; publicist for Stoll's theatres and music halls.,Journalist; Publicist,N/A,N/A,N/A,N/A
CROZIER,Frank Percy,N/A,N/A,N/A,N/A,My Inner Life,1898,N/A,N/A,N/A,N/A,N/A,N/A,N/A,N/A,N/A,"Personal autobiography of his spiritual evolution; reading of Darwin; N. Spencer, etc.",N/A,N/A,N/A,N/A,N/A
CRUDEN,Alexander,N/A,N/A,N/A,N/A,The Adventures of,1754,N/A,N/A,N/A,N/A,N/A,N/A,N/A,N/A,N/A,Experiences of an 18th Century religious fanatic & Biblical student; sufferings in lunatic asylum.,Religious fanatic; Biblical student,N/A,N/A,N/A,N/A
CRUICKSHANK,Brodie,N/A,N/A,N/A,N/A,Eighteen Years,1853,N/A,N/A,N/A,N/A,N/A,N/A,N/A,N/A,N/A,His administrative work on the Gold Coast; culture of Ashanti tribes and government relations; Legislative Council.,Administrator,N/A,N/A,N/A,N/A
CRUTCHLEY,Cam W.,N/A,N/A,N/A,N/A,My Life at Sea,1912,N/A,N/A,N/A,N/A,N/A,N/A,N/A,N/A,N/A,Transition from sail to steam; service in mercantile marine; Secretary of Navy league.,Mercantile Marine,N/A,N/A,N/A,N/A
CRUTCHLOW,William,N/A,N/A,N/A,N/A,Tale of an Old Soldier,1937,N/A,N/A,N/A,N/A,N/A,N/A,N/A,N/A,N/A,"Cabin boy; soldiering in WWI, India, France, Middle East; in merchant navy and army after war; odd jobs.",Soldier; Merchant Navy,N/A,N/A,N/A,N/A
CUDDEFORD,D.W.J.,N/A,N/A,N/A,N/A,And All for What?,1933,N/A,N/A,N/A,N/A,N/A,N/A,N/A,N/A,N/A,Rough and ready account of his service in Scots regiments; France in WWI; with native troops in Africa.,Soldier,N/A,N/A,N/A,N/A
CULLING,Eve H. V.,N/A,N/A,N/A,N/A,Arms and the Woman,1932,N/A,N/A,N/A,N/A,N/A,N/A,N/A,N/A,N/A,"Canteen worker in WWI, with French army; director of canteen at Revigny; French troops.",Canteen Worker,N/A,N/A,N/A,N/A
CUMBERLAND,Gerald (Charles F. Kenyon),N/A,N/A,N/A,N/A,Set Down in Malice,1918,N/A,N/A,N/A,N/A,N/A,N/A,N/A,N/A,N/A,"Manchester Journalist; music, theatre; reminiscences of writers, artists, performers.",Journalist,N/A,N/A,N/A,N/A
CUMBERLAND,Richard,N/A,N/A,N/A,N/A,Memoirs,1806,N/A,N/A,N/A,N/A,N/A,N/A,N/A,N/A,N/A,"His career in the theatre; playwriting; literary society; actors and writers; Johnson; travel and adventures, health, patrons.",Playwright; Actor,N/A,N/A,N/A,N/A
CUMBERLAND,Robert Bakewell,N/A,N/A,N/A,N/A,Stray Leavings,1865,N/A,N/A,N/A,N/A,N/A,N/A,N/A,N/A,N/A,Military career; social life in India; theatricals; sport and Hindu religion; varied; good.,Military Officer,N/A,N/A,N/A,N/A
UMBERLEGE,Adm. Claude,N/A,N/A,N/A,N/A,Master Mariner,1936,N/A,N/A,N/A,N/A,N/A,N/A,N/A,N/A,N/A,Apprentice in last days of sail; commander of brig; arms of South Seas and strange places.,Master Mariner,N/A,N/A,N/A,N/A
CUMING,Sir Alexander,N/A,N/A,N/A,N/A,Autobiographical notes,1764,N/A,N/A,N/A,N/A,N/A,N/A,N/A,N/A,N/A,"Misadventure of a picturesque soldier, debtor, and astrologer; affairs with Cherokees.",Soldier; Debtor; Astrologer,N/A,N/A,N/A,N/A
