author1_last_name,author1_first_name,author2_last_name,author2_first_name,editor1_last_name,editor1_first_name,title,original_date_of_publication,second_or_later_date_of_publication,volume,publisher,publisher_location,number_of_pages,dictation,name_of_transcriber,translation,name_of_translator,summary,occupations,date_of_birth,date_of_death,place_of_birth,other_places_lived
CARDIGAN AND LANCASTER,Adeline L.M. Countess of,N/A,N/A,N/A,N/A,My Recollections,1909,N/A,N/A,N/A,N/A,N/A,N/A,N/A,N/A,N/A,"Girlhood in 1830's; court life, society, country houses; her two marriages; politics; sport; yachting; memories of celebrities.",Countess; noblewoman,N/A,N/A,N/A,N/A
CAREY,Eustace,N/A,N/A,N/A,N/A,"Diary, 1815-1835",1857,N/A,N/A,N/A,N/A,N/A,N/A,N/A,N/A,N/A,Missionary's life in India; teaching Hindus and soldiers; his disputes with Brahmins.,Missionary,N/A,N/A,N/A,N/A
CAREY,Lewis,N/A,N/A,N/A,N/A,My Gun and I,1933,N/A,N/A,N/A,N/A,N/A,N/A,N/A,N/A,N/A,Fowling and rabbiting; hunting in South Africa; fond recollections of life boyhood.,N/A,N/A,N/A,N/A,N/A
CARLETON,William,N/A,N/A,O'Donoghue,David,Life of,1896,N/A,N/A,N/A,N/A,N/A,N/A,N/A,N/A,N/A,"Contains autobiography of early life in County Tyrone and Dublin; poverty; candidate for priesthood; reading, tutoring, writing; difficulties with landladies; his literary work before he became established; entertaining.",N/A,N/A,N/A,N/A,N/A
CARLILE,John C,N/A,N/A,N/A,N/A,My Life's Little Day,1935,N/A,N/A,N/A,N/A,N/A,N/A,N/A,N/A,N/A,"Religion and social reform for 50 years; Bradlaugh, Besant, Spurgeon; educational work; editor of the Baptist Times; movements for unity of free churches.",Social reformer; editor,N/A,N/A,N/A,N/A
CARLIN,Francis,N/A,N/A,N/A,N/A,Reminiscences,1927,N/A,N/A,N/A,N/A,N/A,N/A,N/A,N/A,N/A,Scotland Yard detective; Eltham Common murder and other noted crimes and his part in tracking down criminals.,Detective,N/A,N/A,N/A,N/A
CARLTON,Arthur Philps,N/A,N/A,N/A,N/A,Twenty Years of Spoof,1919,N/A,N/A,N/A,N/A,N/A,N/A,N/A,N/A,N/A,"Poor boyhood; rise as entertainer and conjuror; in markets, fairs, music halls; tours; very anecdotes of show business.",Entertainer; conjuror,N/A,N/A,N/A,N/A
CARLYLE,Alexander,N/A,N/A,N/A,N/A,Autobiography,1860; 1910,N/A,N/A,N/A,N/A,N/A,N/A,N/A,N/A,N/A,"Life and work of minister of Inveresk; leader of the moderate party in Church of Scotland; his friendships with Hume, Smollett, Adam Smith, etc.; excellent for Scotch life and society in 18th Century.",Minister; Church leader,N/A,N/A,N/A,N/A
CARLYLE,Thomas,N/A,N/A,Froude,J.A.,Reminiscences,1881,N/A,N/A,N/A,N/A,N/A,N/A,N/A,N/A,N/A,"Parents, wife and friends; Edward Irving, Southey, Wordsworth, Jeffrey; their influences on him; his life in Scotland.",N/A,N/A,N/A,N/A,N/A
CARLYON,Clement,N/A,N/A,N/A,N/A,Early Years,1836,N/A,N/A,N/A,N/A,N/A,N/A,N/A,N/A,N/A,"Fellow of Pembroke; studies in Germany; literature and philosophy; meditation on history, theology, medicine; literary acquaintances, Coleridge, Scott & Wordsworth; medical work.",Academic; author,N/A,N/A,N/A,N/A
CARPENTER,Edward,N/A,N/A,N/A,N/A,My Days & Dreams,1916,N/A,N/A,N/A,N/A,N/A,N/A,N/A,N/A,N/A,Cambridge University extension and adult education work; lecturing in North and London; farm at Millthorpe; socialist work and journalism; labour movement and friends.,Educator; journalist; socialist,N/A,N/A,N/A,N/A
CARPENTER,Minnie L.,N/A,N/A,N/A,N/A,Angel Adjutant,1921,N/A,N/A,N/A,N/A,N/A,N/A,N/A,N/A,N/A,Life and work of a Salvation Army officer and social worker.,Salvation Army officer; social worker,N/A,N/A,N/A,N/A
CARPENTER,Richard,N/A,N/A,N/A,N/A,Experience,1642,N/A,N/A,N/A,N/A,N/A,N/A,N/A,N/A,N/A,Cambridge student; becomes a Catholic; Douay monastery; ordination; mission to England; rejoins Church of England ministry in Sussex; acrid propaganda vs. Rome.,Catholic priest; Anglican minister,N/A,N/A,N/A,N/A
CARPENTER,Right Rev. William Boyd,N/A,N/A,N/A,N/A,Some Pages of My Life,1911,N/A,N/A,N/A,N/A,N/A,N/A,N/A,N/A,N/A,"Early years, Cambridge; career in Church of England; bishop; London, Ripon, Leeds; public life and figures; Browning; Tennyson.",Bishop; Anglican minister,N/A,N/A,N/A,N/A
CARR,William Guy,N/A,N/A,N/A,N/A,Hell's Angels of the Deep,1932,N/A,N/A,N/A,N/A,N/A,N/A,N/A,N/A,N/A,A boy's experiences at sea; service with Harwich naval force under Tyrwhitt in WWI; submarine work; lively.,Navy,N/A,N/A,N/A,N/A
CARRUTHERS,Anthony Douglas Mitchell,N/A,N/A,N/A,N/A,Beyond the Caspian,1949,N/A,N/A,N/A,N/A,N/A,N/A,N/A,N/A,N/A,The extensive travels and adventures of a geographer and naturalist in Russian Asia during three years; hunting for museums; natives; sports.,"Geographer, Naturalist",N/A,N/A,N/A,N/A
CARSLAKE,Bernard,N/A,N/A,N/A,N/A,Memoirs,1938,N/A,N/A,N/A,N/A,N/A,N/A,N/A,N/A,N/A,"Early days in Australia; racing there; career as Jockey and trainer in Hungary, South Africa, India and England; sportsmen; scandals.","Jockey, Trainer",N/A,N/A,N/A,N/A
CARSTAIRS,John Paddy,N/A,N/A,N/A,N/A,Don't We the Gaiety,1942,N/A,N/A,N/A,N/A,N/A,N/A,N/A,N/A,N/A,Honest school days; author and film director in Hollywood; film stars; broadcasting and films; life in RNVR & experiences in London Blitz.,"Author, Film Director",N/A,N/A,N/A,N/A
CARSTAIRS,Robert,N/A,N/A,N/A,N/A,Autobiography of an Indian District Officer,1912,N/A,N/A,N/A,N/A,N/A,N/A,N/A,N/A,N/A,"His work and life in Bengal; medical, legal, police affairs; social life; Hindu traits.",District Officer,N/A,N/A,N/A,N/A
CARSWELL,Catherine R.,N/A,N/A,N/A,N/A,Awake,1950,N/A,N/A,N/A,N/A,N/A,N/A,N/A,N/A,N/A,Mostly describes her upbringing in a Glasgow bourgeois family in late Victorian period; religion; puritanism; little about her literary life or about D. H. Lawrence.,N/A,N/A,N/A,N/A,N/A
CARTER,Albert C. R.,N/A,N/A,N/A,N/A,Let Me Tell You,1940,N/A,N/A,N/A,N/A,N/A,N/A,N/A,N/A,N/A,Art critic's experiences in art & literature; auctions and behind the scenes anecdotes.,Art Critic,N/A,N/A,N/A,N/A
CARTER,Barbara Barclay,N/A,N/A,N/A,N/A,Old Nurse,1936,N/A,N/A,N/A,N/A,N/A,N/A,N/A,N/A,N/A,Welsh nanna and her charges in Brecon; Welsh country life & children and their ways; good.,Nurse,N/A,N/A,N/A,N/A
CARTER,George,N/A,N/A,Gale,I. H.,Hound and Horn,1885,N/A,N/A,N/A,N/A,N/A,N/A,N/A,N/A,N/A,Reported reminiscences of West Country life and hunting.,N/A,N/A,N/A,N/A,N/A
CARTER,George G.,N/A,N/A,N/A,N/A,Able Seaman,1948,N/A,N/A,N/A,N/A,N/A,N/A,N/A,N/A,N/A,His career in the merchant navy; experiences in Pacific and West Indies; farming in England; lively.,Able Seaman,N/A,N/A,N/A,N/A
CARTER,Capt.,N/A,N/A,Cornish,J.B.,Autobiography Cornish Smuggler,1894,N/A,N/A,N/A,N/A,N/A,N/A,N/A,N/A,N/A,Lively account of activities as smuggler to 1809 and of his religious life; authentic; interesting language.,Smuggler,N/A,N/A,N/A,N/A
CARTLAND,Barbara,N/A,N/A,N/A,N/A,The Isthmus Years,1943,N/A,N/A,N/A,N/A,N/A,N/A,N/A,N/A,N/A,"Her work, as journalist and novelist; public events, society, the war years; covers 1918-43.","Journalist, Novelist",N/A,N/A,N/A,N/A
CARTON,Ronald,N/A,N/A,N/A,N/A,The Gentle Adventure,1933,N/A,N/A,N/A,N/A,N/A,N/A,N/A,N/A,N/A,"A child's life in suburbia in reign of Victoria; domestic and middle-class life; patriotism; robust, healthy childhood.",N/A,N/A,N/A,N/A,N/A
CARTON DE WIART,General Sir Adrian,N/A,N/A,N/A,N/A,Happy Odyssey,1950,N/A,N/A,N/A,N/A,N/A,N/A,N/A,N/A,N/A,"War experiences of a Belgian-born British general; in Boer War as private; WWI in France; in Poland after war; in Libya, Italy and China in WWII; adventures in remarkable career of a committed soldier; military and political celebrities.",General,N/A,N/A,N/A,N/A
CARVER,Mrs. John,N/A,N/A,N/A,N/A,Recollections of My Old Homes,1908,N/A,N/A,N/A,N/A,N/A,N/A,N/A,N/A,N/A,Domestic life in Liverpool in reign of Victoria.,N/A,N/A,N/A,N/A,N/A
CARVOSSO,William,N/A,N/A,N/A,N/A,Memoir,1847,N/A,N/A,N/A,N/A,N/A,N/A,N/A,N/A,N/A,A Cornish Methodist minister; religious life in Redruth.,Methodist Minister,N/A,N/A,N/A,N/A
CARY,Catherine E.,N/A,N/A,N/A,N/A,Memoirs,1825,N/A,N/A,N/A,N/A,N/A,N/A,N/A,N/A,N/A,In service of Queen Caroline; court life and anecdotes of society and royalty; sentimental and disguised.,N/A,N/A,N/A,N/A,N/A
CASE,Mrs. Adelaide,N/A,N/A,N/A,N/A,Born at Lucknow,1858,N/A,N/A,N/A,N/A,N/A,N/A,N/A,N/A,N/A,Diary of a soldier's wife at the siege; sufferings of civilians and soldiers.,Soldier's Wife,N/A,N/A,N/A,N/A
CASE,Thomas Henry,N/A,N/A,N/A,N/A,Memories,1899,N/A,N/A,N/A,N/A,N/A,N/A,N/A,N/A,N/A,Chorister at King's in 30's and 40's; routine; and anecdotes of church musicians.,Chorister,N/A,N/A,N/A,N/A
CASSE,George Richard,N/A,N/A,N/A,N/A,Authentic Narrative,1841,N/A,N/A,N/A,N/A,N/A,N/A,N/A,N/A,N/A,Kentish sailor captured by French; imprisonment 1809-14; hard atrocities.,Sailor,N/A,N/A,N/A,N/A
CASSELLS,Joe,N/A,N/A,N/A,N/A,With the Black Watch,1919,N/A,N/A,N/A,N/A,N/A,N/A,N/A,N/A,N/A,With original BEF in France in WWI; Mons; hospital life; good.,Soldier,N/A,N/A,N/A,N/A
CASSERLEY,Julian Victor,N/A,N/A,N/A,N/A,No Faith of My Own,1950,N/A,N/A,N/A,N/A,N/A,N/A,N/A,N/A,N/A,Spiritual autobiography; his atheistic upbringing and his gradual conversion; life as Church of England rector.,Rector,N/A,N/A,N/A,N/A
CASSERLY,Major Gordon,N/A,N/A,N/A,N/A,Life in an Indian Outpost,1914,N/A,N/A,N/A,N/A,N/A,N/A,N/A,N/A,N/A,"Military life, sport and social affairs in Himalayas in late 19th Century.",Major,N/A,N/A,N/A,N/A
CASSIDY,Thomas,N/A,N/A,N/A,N/A,Autobiography of an Augustinian priest,N/A,N/A,N/A,N/A,N/A,N/A,N/A,N/A,N/A,N/A,Life and adventures.,Augustinian Priest,N/A,N/A,N/A,N/A
CASSON,Stanley,N/A,N/A,N/A,N/A,Steady Drummer,1935,N/A,N/A,N/A,N/A,N/A,N/A,N/A,N/A,N/A,"Experiences in WWI; mostly the Balkan campaign, Salonika & Caucasia; personal.",N/A,N/A,N/A,N/A,N/A
CASTLEHAVEN,"James Touchet, 3rd Earl",N/A,N/A,N/A,N/A,Memoirs of James Lord Audley,1680,N/A,N/A,N/A,N/A,N/A,N/A,N/A,N/A,N/A,"Autobiography of his activities in the Irish wars, 1642-51; military affairs and politics.",Earl,N/A,N/A,N/A,N/A
CASTLETOWN,"Bernard E. B. FitzPatrick, 2nd Baron",N/A,N/A,N/A,N/A,Ego,1923,N/A,N/A,N/A,N/A,N/A,N/A,N/A,N/A,N/A,"Military career; Franco-Prussian War; Egypt and Boer War; WWI; travel, hunting, Irish country life, anecdotes.",Baron,N/A,N/A,N/A,N/A
CATHCART-JONES,Lt. Owen,N/A,N/A,N/A,N/A,Aviation Memoirs,1934,N/A,N/A,N/A,N/A,N/A,N/A,N/A,N/A,N/A,"Naval flying 1925-29; & civil flying thereafter; his record flights to Australia; dangers, adventures, triumphs; social life.",Lt.,N/A,N/A,N/A,N/A
CATLING,Thomas,N/A,N/A,N/A,N/A,My Life's Pilgrimage,N/A,N/A,N/A,N/A,N/A,N/A,N/A,N/A,N/A,N/A,"Early life from 1838; his career in journalism; editor, Lloyd's Weekly; national events and politics; social changes.",Journalist,N/A,N/A,N/A,N/A
CATON,William,N/A,N/A,N/A,N/A,Journal of the Life,1689,N/A,N/A,N/A,N/A,N/A,N/A,N/A,N/A,N/A,"A foundation Quaker autobiography, 1652-64; his ministry and sufferings in England, Holland, Germany; Lancashire.",Quaker Minister,N/A,N/A,N/A,N/A
CATTLEY,Stephen,N/A,N/A,N/A,N/A,Autobiography of Camberwell businessman,1751-1821,N/A,N/A,N/A,N/A,N/A,N/A,N/A,N/A,N/A,Trading in Russia; family affairs and business.,Businessman,N/A,N/A,N/A,N/A
CAUDWELL,Francis,N/A,N/A,N/A,N/A,The C; 38 in Places,1903,N/A,N/A,N/A,N/A,N/A,N/A,N/A,N/A,N/A,Parish work of a Church of England vicar; North & East London; slums; working-class life.,Vicar,N/A,N/A,N/A,N/A
CAUGHEY,James,N/A,N/A,N/A,N/A,Earnest Christianity,1857,N/A,N/A,N/A,N/A,N/A,N/A,N/A,N/A,N/A,Spiritual record of Methodist minister in Yorkshire; revivalism in Huddersfield in 40's and 50's.,Methodist Minister,N/A,N/A,N/A,N/A
CAVALIR,Anthony Ramsden,N/A,N/A,N/A,N/A,In Northern India,1899,N/A,N/A,N/A,N/A,N/A,N/A,N/A,N/A,N/A,Missionary work in zenanas; medical work; travels; religious life; observations on a tour of the missions.,Missionary,N/A,N/A,N/A,N/A
CAVALRY OFFICER,N/A,N/A,N/A,N/A,N/A,Military Service & Adventures in the Far East,1847,N/A,N/A,N/A,N/A,N/A,N/A,N/A,N/A,N/A,His army service in India; Afghan and Sikh campaigns.,Officer,N/A,N/A,N/A,N/A
CAVANAUGH,Timothy,N/A,N/A,N/A,N/A,Scotland Yard,1893,N/A,N/A,N/A,N/A,N/A,N/A,N/A,N/A,N/A,"His career in the police force from 1855; The Borough; chief inspector at Scotland Yard; the social scene in London; music halls, theatres, shows and Drury Lane and Covent Garden.",Police Inspector,N/A,N/A,N/A,N/A
CAVE,Sir Genille Cave-Browne,N/A,N/A,N/A,N/A,From Cowboy to Pulpit,1926,N/A,N/A,N/A,N/A,N/A,N/A,N/A,N/A,N/A,"Early days as sailor and in circus; mining, ranching and evangelism in America; ordination and Church of England ministry; tales from an extraordinary career.",Minister,N/A,N/A,N/A,N/A
CAVE OF RICHMOND,"Ann Estella Sarah Penfold, Countess",N/A,N/A,N/A,N/A,Odds and Ends,1929,N/A,N/A,N/A,N/A,N/A,N/A,N/A,N/A,N/A,Domestic life; society; public figures; fashions; servants; collecting.,Countess,N/A,N/A,N/A,N/A
CAVENAGH,Orfeur (Sir),N/A,N/A,N/A,N/A,Reminiscences of an Indian Official,1884,N/A,N/A,N/A,N/A,N/A,N/A,N/A,N/A,N/A,"Military career; cadet in Straits Settlement; administration and diplomacy in India, Burma, and Malaya; social life; 1837 to 1880.",Official; diplomat,N/A,N/A,N/A,N/A
CAVENDISH,Francis W. H.,N/A,N/A,N/A,N/A,"Society, Politics and Diplomacy",1913,N/A,N/A,N/A,N/A,N/A,N/A,N/A,N/A,N/A,Precis writer to Russell and Clarendon; Whig political and international affairs; society gossip; anecdotes.,Precis writer; politician,N/A,N/A,N/A,N/A
CAYLEY,Cornelius,N/A,N/A,N/A,N/A,Life and Conversion,1819,N/A,N/A,N/A,N/A,N/A,N/A,N/A,N/A,N/A,Spiritual autobiography of lay preacher in London and Wales; early days in London.,Lay preacher,N/A,N/A,N/A,N/A
CECIL,"Edward Herbert Gascoyne, Lord",N/A,N/A,N/A,N/A,Leisure of an Egyptian Official,1921,N/A,N/A,N/A,N/A,N/A,N/A,N/A,N/A,N/A,His eighteen years as British official in Egypt; diplomacy; official & social life; the lighter side.,Official; diplomat,N/A,N/A,N/A,N/A
CECIL OF CHELWOOD,"Edgar Algernon Robert Gascoyne-Cecil, 1st Viscount",N/A,N/A,N/A,N/A,Statesman's Career,1941,N/A,N/A,N/A,N/A,N/A,N/A,N/A,N/A,N/A,Public affairs and society in Edwardian and recent times; the League of Nations and his part in it.,Statesman,N/A,N/A,N/A,N/A
CENNICK,John,N/A,N/A,N/A,N/A,Life,1789,N/A,N/A,N/A,N/A,N/A,N/A,N/A,N/A,N/A,Reading man's sins & conversion to Methodism; the Wesleys and Whitfield; his work at Hitchin and teaching at Kingswood; brief account.,Methodist preacher,N/A,N/A,N/A,N/A
CHADWICK,William S.,N/A,N/A,N/A,N/A,Man-Killers and Marauders,1929,N/A,N/A,N/A,N/A,N/A,N/A,N/A,N/A,N/A,Twenty-five years as guide and professional hunter in Central Africa; kills; escapes.,Guide; professional hunter,N/A,N/A,N/A,N/A
CHALLE-LONG,Charles,N/A,N/A,N/A,N/A,My Life,1912,N/A,N/A,N/A,N/A,N/A,N/A,N/A,N/A,N/A,Military career and travel in four continents; Gordon; the Egyptian campaigns; chief of staff; criticisms of the campaign.,Military officer,N/A,N/A,N/A,N/A
CHALKLEY,Thomas,N/A,N/A,N/A,N/A,Journal of the Life,1749,N/A,N/A,N/A,N/A,N/A,N/A,N/A,N/A,N/A,Spiritual autobiography; travels of Quaker in England and America; Friends' meetings; 18th Century.,Quaker,N/A,N/A,N/A,N/A
CHALLENGER,Charles,N/A,N/A,N/A,N/A,Colliery Life,1884,N/A,N/A,N/A,N/A,N/A,N/A,N/A,N/A,N/A,"Bristol man's experiences as collier boy in Somerset mine; work and dangers, conditions, pay and other interesting details.",Collier,N/A,N/A,N/A,N/A
CHALMERS,James,N/A,N/A,N/A,N/A,Autobiography and Letters,1902,N/A,N/A,N/A,N/A,N/A,N/A,N/A,N/A,N/A,"His boyhood and early religious work in Scotland; pioneer missionary work in Rarotonga, and New Guinea from 1877; adventures; explorations; native life, religion & customs.",Missionary,N/A,N/A,N/A,N/A
CHAMBERLAIN,John,N/A,N/A,Yates,William,Memoirs,N/A,N/A,N/A,N/A,N/A,N/A,N/A,N/A,N/A,N/A,"Journal extracts, 1798-1817; life in Bristol; religious activities; missionary work & travels in India; his own spiritual life and introspection.",Missionary,N/A,N/A,N/A,N/A
CHAMBERLAIN,J. Austen (Sir),N/A,N/A,N/A,N/A,Down the Years,1935,N/A,N/A,N/A,N/A,N/A,N/A,N/A,N/A,N/A,"Study in Paris and Berlin; political career, public events and issues, and political figures; chief statesman of the 20's; some domestic items; travel in Europe and art impressions.",Statesman,N/A,N/A,N/A,N/A
CHAMBERS,Bertram Mordaunt (Adm.),N/A,N/A,N/A,N/A,Salt Junk,1927,N/A,N/A,N/A,N/A,N/A,N/A,N/A,N/A,N/A,"Naval career and reminiscences, 1881-1906; Egyptian war; social, sport, notes on the places he had been to and things he had seen.",Naval officer,N/A,N/A,N/A,N/A
CHAMBERS,George F.,N/A,N/A,N/A,N/A,Memories,1910,N/A,N/A,N/A,N/A,N/A,N/A,N/A,N/A,N/A,"An account of people and things in Eastbourne from 1845; and his part in the affairs of the town; author, astronomer, churchman, local official.",Author; astronomer; churchman; local official,N/A,N/A,N/A,N/A
CHARLES,Elizabeth (Rundle),N/A,N/A,N/A,N/A,Qur Seven Homes,1896,N/A,N/A,N/A,N/A,N/A,N/A,N/A,N/A,N/A,"Author's childhood in Tavistock; pleasant environment and governesses; marriage and widowhood life in London and Hampstead; religion & Oxford Movement; her poetry and writing; inner life; fond, sentimental record.",N/A,N/A,N/A,N/A,N/A
CHARLES,Thomas,N/A,N/A,Morgan,Edward,Life and Letters,1881,N/A,N/A,N/A,N/A,N/A,N/A,N/A,N/A,N/A,Autobiography of minister of Bala; Welsh religious life and work; inner life and moralisings.,Minister,N/A,N/A,N/A,N/A
CHARLTON,Barbara,N/A,N/A,N/A,N/A,A Northumbrian Lady at Hesleyside in 1815-66,N/A,N/A,N/A,N/A,N/A,N/A,N/A,N/A,N/A,N/A,"Written up from diaries; convent education; family life; parental troubles; marriage and domestic life; social scene; difficulties of everyday life; railroad; Patrick Bronte, Swinburne, Mrs. Wordsworth; very interesting.",N/A,N/A,N/A,N/A,N/A
CHARLTON,Lionel E.,N/A,N/A,N/A,N/A,Charlton,1931,N/A,N/A,N/A,N/A,N/A,N/A,N/A,N/A,N/A,"Victorian childhood; Sandhurst life; service in Boer War and Montserrat; training as a flyer and flying service in WWI; Air Commodore; retirement; socialism, writing, BBC; crises of 30's.",Air Commodore,N/A,N/A,N/A,N/A
CHARTERIS,Brig.Cen. John,N/A,N/A,N/A,N/A,At G.H.Q.,1931,N/A,N/A,N/A,N/A,N/A,N/A,N/A,N/A,N/A,Experiences at Western Front Headquarters 1914-18; letters amplified by recollections; higher command; mostly impersonal.,Brigadier General,N/A,N/A,N/A,N/A
CHARTERS,James,N/A,N/A,N/A,N/A,This Must Be the Childhood in Chatham and Place,1934,N/A,N/A,N/A,N/A,N/A,N/A,N/A,N/A,N/A,Nine years as barman in Montparnasse; with anecdotes of customers.,Barman,N/A,N/A,N/A,N/A
CHATFIELD,"Alfred Ernle Montacute, Lord",N/A,N/A,N/A,N/A,The N and Defence,1942,N/A,N/A,N/A,N/A,N/A,N/A,N/A,N/A,N/A,"His naval career from 1893; Controller of Navy; 1st Sea Lord, Minister for Coordination of Defence; wide experiences of a devoted public servant; some personal and family, but mostly didactic; an important record.",Naval Officer,N/A,N/A,N/A,N/A
CHATFIELD-TAYLOR,Hobart Chatfield,N/A,N/A,N/A,N/A,Cities of Many Men,1925,N/A,N/A,N/A,N/A,N/A,N/A,N/A,N/A,N/A,"Experience as a boy in London, Paris, New York & Chicago; impressions of souls of towns; former customs; social history; family life; tolerant.",N/A,N/A,N/A,N/A,N/A
CHATTERTON,Right Rev. Eyre,N/A,N/A,N/A,N/A,A Bishop's D.,1935,N/A,N/A,N/A,N/A,N/A,N/A,N/A,N/A,N/A,"Work in Nagpur diocese, 1903-26; missionary activities; education; celebrities; & service with Indian Corps, WWI, France.",Bishop,N/A,N/A,N/A,N/A
CHATTO,William Andrew,N/A,N/A,N/A,N/A,Scenes and recollections of F. Fish,N/A,N/A,N/A,N/A,N/A,N/A,N/A,N/A,N/A,N/A,"Reminiscences of sport in Lake District & the northern counties; in dialogue form, modelled on Compleat Angler.",N/A,N/A,N/A,N/A,N/A
CHEESMAN,Lucy Evelyn,N/A,N/A,N/A,N/A,Hunting Insects,1932,N/A,N/A,N/A,N/A,N/A,N/A,N/A,N/A,N/A,Her adventures and observations during entomological expeditions to the South Seas.,Entomologist,N/A,N/A,N/A,N/A
CHEKE,Marcus,N/A,N/A,N/A,N/A,The Licking,1931,N/A,N/A,N/A,N/A,N/A,N/A,N/A,N/A,N/A,Army officer’s son; recollections up to WWI; school; holidays; country sports; sensitive account of a fortunate childhood.,N/A,N/A,N/A,N/A,N/A
CHELSEA PENSIONER,N/A,N/A,N/A,N/A,N/A,Jottings from My Sabretasche,1847,N/A,N/A,N/A,N/A,N/A,N/A,N/A,N/A,N/A,Shropshire boyhood and enlistment in Dragoons; Peninsular War; Waterloo; soldier's life; pleasant simple record; low language.,Soldier,N/A,N/A,N/A,N/A
CHESHIRE,Leonard,N/A,N/A,N/A,N/A,Bomber Pilot,1943,N/A,N/A,N/A,N/A,N/A,N/A,N/A,N/A,N/A,"Personal narrative of service in WWII; training as flyer, squadron-leader; missions over Germany; danger and escapes.",Pilot,N/A,N/A,N/A,N/A
CHESSYRE,Henry T. N.,N/A,N/A,N/A,N/A,Recollections,1861,N/A,N/A,N/A,N/A,N/A,N/A,N/A,N/A,N/A,Inheritance; five years' life and sport in Norway; customs and folk lore.,N/A,N/A,N/A,N/A,N/A
CHESTER,Francis,N/A,N/A,N/A,N/A,Shot Full,1938,N/A,N/A,N/A,N/A,N/A,N/A,N/A,N/A,N/A,"Morphine and cocaine addict; cardsharp, clown, poacher, cook, shoplifter and informer; unpleasant.",N/A,N/A,N/A,N/A,N/A
CHESTERTON,George Laval,N/A,N/A,N/A,N/A,"Peace, War and Adventure",1853,N/A,N/A,N/A,N/A,N/A,N/A,N/A,N/A,N/A,Military career 1812-20; Peninsular War and 1812 War; New Orleans; captain in Colombian army and service in South America; Bolivar; later service in British prisons and houses of correction.,Military Officer,N/A,N/A,N/A,N/A
CHESTERTON,Gilbert Keith,N/A,N/A,N/A,N/A,Autobiography,1936,N/A,N/A,N/A,N/A,N/A,N/A,N/A,N/A,N/A,"Quizzical, argumentative account of life, tastes, beliefs; literature, religion, politics; cult of Notting Hill; romance of bourgeoisie and 'his political and literary friendships.",Writer,N/A,N/A,N/A,N/A
CHETWYND,Sir George,N/A,N/A,N/A,N/A,Life on Turf,1869,N/A,N/A,N/A,N/A,N/A,N/A,N/A,N/A,N/A,"Horses, races, owners; his work at the Jockey Club; handicapping & breeding.",N/A,N/A,N/A,N/A,N/A
CHEVALIER,Albert,N/A,N/A,N/A,N/A,Record,1895,N/A,N/A,N/A,N/A,N/A,N/A,N/A,N/A,N/A,Reminiscences of great music hall comedian; his Cockney studies; tours; ups and downs; the social life of the theatres.,Comedian,N/A,N/A,N/A,N/A
CHEYNE,George,N/A,N/A,N/A,N/A,Account of Himself,1743,N/A,N/A,N/A,N/A,N/A,N/A,N/A,N/A,N/A,"Brief account of the career, studies, and writings of a mystic and physician.",Mystic; Physician,N/A,N/A,N/A,N/A
CHICHESTER,Francis Charles,N/A,N/A,N/A,N/A,Ride on the Wind,1936,N/A,N/A,N/A,N/A,N/A,N/A,N/A,N/A,N/A,"Travels and adventure of tramp and airman; England, Pacific, China, Northern Canada.",Airman,N/A,N/A,N/A,N/A
CHIGNELL,Arthur Kent,N/A,N/A,N/A,N/A,An Outpost in Papua,1911,N/A,N/A,N/A,N/A,N/A,N/A,N/A,N/A,N/A,His missionary labours in New Guinea; native life.,Missionary,N/A,N/A,N/A,N/A
HILD,Harold,N/A,N/A,N/A,N/A,Poor Player,1939,N/A,N/A,N/A,N/A,N/A,N/A,N/A,N/A,N/A,"Account of his not very brilliant theatrical career, 1894 to 1914; London plays; anecdotes.",Theatrical Performer,N/A,N/A,N/A,N/A
CHILDS,Sir Borlase Elward,N/A,N/A,N/A,N/A,Episodes and Reflections,1930,N/A,N/A,N/A,N/A,N/A,N/A,N/A,N/A,N/A,The general's military career; Boer War; Ceylon; South Africa; WWI; India; and social life and sport; reflections of a reactionary on contemporary events and customs.,General,N/A,N/A,N/A,N/A
CHIROL,Sir Ignatius Valentine,N/A,N/A,N/A,N/A,Fifty Years,1927,N/A,N/A,N/A,N/A,N/A,N/A,N/A,N/A,N/A,Observations of public events from Paris Commune 1871 to Versailles; a Journalist's record of politics and war; impersonal.,Journalist,N/A,N/A,N/A,N/A
CHOLMLEY,Sir Hugh,N/A,N/A,N/A,N/A,Memoirs,1787,N/A,N/A,N/A,N/A,N/A,N/A,N/A,N/A,N/A,"His family; childhood & married life and business, and his adventures as a royalist during the Civil Wars; siege of Scarborough and affairs in Yorkshire; interesting.",Royalist,N/A,N/A,N/A,N/A
CHOLMONDELEY,Mary,N/A,N/A,N/A,N/A,Under One Roof,1918,N/A,N/A,N/A,N/A,N/A,N/A,N/A,N/A,N/A,Her childhood in a Shropshire rectory; the family; clerical and domestic life in Victorian era.,N/A,N/A,N/A,N/A,N/A
CHORLEY,Henry Fothergill,N/A,N/A,N/A,N/A,Music and Manners in France and Germany,181,N/A,N/A,N/A,N/A,N/A,N/A,N/A,N/A,N/A,"Autobiography 1873 Career and reminiscences of critic of 'Athenaeum'; early life in Lancashire; literary and musical life in London and friendship with chief Victorian writers and artists; opera, art, travels; his own verses and writing.",Critic; Writer,N/A,N/A,N/A,N/A
CHOYCE,James,N/A,N/A,N/A,N/A,The Log of a Jack Tar,1891,N/A,N/A,N/A,N/A,N/A,N/A,N/A,N/A,N/A,"Life of master mariner, 1793-1820; whaling; capture and slavery in South American mines; whaling again; adventures in Spanish and British ships; sea actions during Napoleonic wars; a lively life.",Master Mariner,N/A,N/A,N/A,N/A
CHRISTIE,A.,N/A,N/A,N/A,N/A,Brass Tacks,1943,N/A,N/A,N/A,N/A,N/A,N/A,N/A,N/A,N/A,"Childhood in Kilmarnock; his hardware shop; music and theatres; people, local events, pastimes.",N/A,N/A,N/A,N/A,N/A
CHRISTIE,Dugald,N/A,N/A,N/A,N/A,Ten Years in Man; Thirty Years in Moukden,1895,N/A,N/A,N/A,N/A,N/A,N/A,N/A,N/A,N/A,Work and travels of a medical missionary; medical education; plague; Chino-Japanese war; Boxer Rebellion; Red Cross work.,Medical missionary,N/A,N/A,N/A,N/A
CHRISTIE,Ella Robertson,N/A,N/A,STEWART,Lady Alice Margaret King,Long Look at Life,1940,N/A,N/A,N/A,N/A,N/A,N/A,N/A,N/A,N/A,"The life of two sisters from the 60's; their girlhood and social life in Scotland; music interests; travel in the East; Stevenson; Andrew Lang, etc.",N/A,N/A,N/A,N/A,N/A
CHRISTIE,Octavius Francis,N/A,N/A,N/A,N/A,Clifton School Days,1930,N/A,N/A,N/A,N/A,N/A,N/A,N/A,N/A,N/A,"His experience at Clifton when it was a new school; the education, masters, boys, and sports, in 1879-85.",N/A,N/A,N/A,N/A,N/A
CHRISTISON,Sir Robert,N/A,N/A,N/A,N/A,Autobiography,1885,N/A,N/A,N/A,N/A,N/A,N/A,N/A,N/A,N/A,"Edinburgh university; medical studies; practice and teaching in Edinburgh and London; reminiscences of doctors, medical practice, and experiments; hydrophobia; body-snatching; social life; medical fashions; climbing and sport.",Sir; medical practitioner; educator,N/A,N/A,N/A,N/A
CHRISTY,Cuthbert,N/A,N/A,N/A,N/A,Big Game,1924,N/A,N/A,N/A,N/A,N/A,N/A,N/A,N/A,N/A,Hunter and naturalist in Congo; guest of Okapi; adventures; native life.,Hunter; naturalist,N/A,N/A,N/A,N/A
